reviewText,rating,summary,review_sentiment,summary_sentiment,hallucination,hal_score
bought them for a white party... fit perfectly!,5,Five Stars,POSITIVE,POSITIVE,neutral,0.9628115296363831
"been wearing them since they were $3.99 a pair-
aint stopping now!",5,Five Stars,NEGATIVE,POSITIVE,neutral,0.917858898639679
"My husband has wore Levi's for almost 50 years, never bought on line till the last two times, they fit perfect....",5,Excellant...,POSITIVE,POSITIVE,neutral,0.736343502998352
These fit great. Nothing wears as comfortable as a good pair of 501 jeans.,4,Love 501,POSITIVE,POSITIVE,entailment,0.5653185248374939
Awesome and fast!,5,Five Stars,POSITIVE,POSITIVE,neutral,0.9342031478881836
Love it,5,Five Stars,POSITIVE,POSITIVE,neutral,0.9356459975242615
Fits good,4,Good jeans,POSITIVE,POSITIVE,neutral,0.820078432559967
These are all my husband will wear and we were happy to find them on-line for less $$ that at Pennys.,4,... are all my husband will wear and we were happy to find them on-line for less $$ that at ...,NEGATIVE,NEGATIVE,entailment,0.9780029654502869
Poor quality and sized different then my other Levi's. Not happy with this purchase. Just seems to be the way things are going. Cheaply made crap. You're just paying for the name now.,3,Poor quality and sized different then my other Levi's,NEGATIVE,NEGATIVE,entailment,0.9699631333351135
"These jeans are very satisfactory.
Only thing Is the material is thinner than my other 501,s
Even so the fit and comfort are very good.",5,501 Men's jeans,POSITIVE,POSITIVE,neutral,0.8761578798294067
Fit perfect.,5,Five Stars,POSITIVE,POSITIVE,neutral,0.9643390774726868
Fits as expected. Arrived in a timely manner.,5,Good One,POSITIVE,POSITIVE,neutral,0.8503373861312866
Just what I expected. I've worn 501's for years.,5,An old favorite,NEGATIVE,POSITIVE,neutral,0.8962856531143188
I've been wearing Levi 501's for more years than I can remember.  They are consistently perfect.  It's my body that changes.,5,They are consistently perfect. It's my body that changes,POSITIVE,POSITIVE,entailment,0.897104799747467
"They fit the same way this did in high school, and that was in the 70's.",5,Some things never change,NEGATIVE,NEGATIVE,neutral,0.9354864358901978
My husband loves the jeans fit perfect and wash great.,5,Five Stars,POSITIVE,POSITIVE,neutral,0.9710816144943237
Great fit. Super fast delivery,4,Four Stars,POSITIVE,POSITIVE,neutral,0.9664111137390137
fit as expected! will buy again),5,Five Stars,POSITIVE,POSITIVE,neutral,0.9174623489379883
great way to buy my jeans but the crotch area is already ripping open and I just bought them in August.,1,1 star,NEGATIVE,POSITIVE,neutral,0.9049187898635864
I was surprised with buttons in the fly. Was expecting zipper.,3,Three Stars,NEGATIVE,POSITIVE,contradiction,0.6219474673271179
Perfect fit,5,Five Stars,POSITIVE,POSITIVE,neutral,0.9306688904762268
"Good jeans, quality as expected despite the reports one reads of recent quality loss at Levi's. I  dropped them two stars due to Levi's not having a living wage policy for their supply chain. Time they got with it so this is likely to be my last Levis purchase.",3,"Good jeans, quality as expected despite the reports one ...",NEGATIVE,POSITIVE,entailment,0.6882704496383667
"Black 501s always seem smaller than blue 501s, so I order 1 inch bigger waist",5,Five Stars,NEGATIVE,POSITIVE,neutral,0.8070235848426819
I received my all white original fit and looks amazing  especially good for going out and trying a different  look get alot of complements  in these nice color and fit no zipper to zip them up tho you have 4 buttons,5,Nice,POSITIVE,POSITIVE,neutral,0.8634752035140991
Always a 501 Levi's lover,5,Five Stars,POSITIVE,POSITIVE,neutral,0.8075253367424011
Perfect fit,5,Five Stars,POSITIVE,POSITIVE,neutral,0.9306688904762268
These are not prewash,4,Four Stars,POSITIVE,POSITIVE,neutral,0.848825991153717
Can't get a better pair of jeans. 'nuf said.,5,Classic jeans,NEGATIVE,POSITIVE,entailment,0.7354198694229126
Great fit; great product; great service!,5,Five Stars,POSITIVE,POSITIVE,neutral,0.9479339718818665
Quality jeans at a reasonable price,5,Quality plus a perfect fit.,POSITIVE,POSITIVE,neutral,0.9247881174087524
Excellent and timely delivery. My husband's favorite jeans.,5,Perfect fit,POSITIVE,POSITIVE,neutral,0.9777359962463379
Perfecto,5,Five Stars,POSITIVE,POSITIVE,neutral,0.7591842412948608
Great fit!!,5,Five Stars,POSITIVE,POSITIVE,neutral,0.9226866960525513
Nice! Fit well and look great.,5,Five Stars,POSITIVE,POSITIVE,neutral,0.9853630065917969
501 button fly the greatest fit yet I want more,5,Five Stars,POSITIVE,POSITIVE,neutral,0.7495095133781433
"Love my jeans, but when I got 501's you always get 1 extra inch in the waist and 3 inches in length for shrinkage.  My jeans showed no shrinkage even in hot water...But I do love the jeans. Even cuffed..,",4,Love my jeans,POSITIVE,POSITIVE,neutral,0.7898139357566833
bought 2 pair of Levis 501 original jeans...one in black the other in stonwashed blue....both pair labeled 33x30 yet the black are almost 3 inches longer in length and the waist almost 2 inches bigger..stonewashed blue were a perfect fit...now I have to go thru the trouble of returning them,1,stonewashed blue were a perfect fit.,NEGATIVE,POSITIVE,contradiction,0.6539557576179504
Button fly was not on the product description...quite a surprise!,1,One Star,NEGATIVE,NEGATIVE,neutral,0.9154923558235168
They are 501's  Nuff said.,5,Levis,NEGATIVE,POSITIVE,contradiction,0.8659092783927917
"I ordered a refund as I got the wrong pair in 30x32, They ran a little small in the length so I decided to go up two inches in my refund 30x34. A little disappointed that I got the wrong size but nevertheless I learned about the 501 jeans quality and fit. Hopefully my refund arrives shortly after I ship the product back to ups",5,:((,NEGATIVE,NEGATIVE,neutral,0.9860016107559204
Nice,5,As expected,POSITIVE,NEGATIVE,neutral,0.8608685731887817
To small,2,Two Stars,NEGATIVE,POSITIVE,neutral,0.45484042167663574
Fast shipping. Excellent as always!,5,Excellent as always,POSITIVE,POSITIVE,entailment,0.8510855436325073
Too Small for me.,1,One Star,NEGATIVE,NEGATIVE,contradiction,0.6470789313316345
My son loves these jeans.  They look good and fit well.,5,My son loves them!,POSITIVE,POSITIVE,entailment,0.9402273893356323
"WY DO MAKE IT SO DIFFICULT  TO PLACE AN ORDER AND AND THEN TRY TO MAKE CHANGES AS HOW MANY,COLORS,SIZES,ETC. WHICH MAKES GO BACK TO E BAY TO BUY PRODUCTS.",5,WY DO MAKE IT SO DIFFICULT TO PLACE AN ORDER ...,NEGATIVE,NEGATIVE,neutral,0.8792014718055725
Fit great,5,Five Stars,POSITIVE,POSITIVE,neutral,0.954380214214325
Pants were nice just wrong size.,5,Five Stars,NEGATIVE,POSITIVE,neutral,0.746248185634613
fits perfect! very comfortable.,5,fits great!,POSITIVE,POSITIVE,neutral,0.9806548357009888
Great value,5,Five Stars,POSITIVE,POSITIVE,neutral,0.9204988479614258
"Rock solid purchase, quite pleased",5,Thumbs up,POSITIVE,POSITIVE,neutral,0.524782657623291
"Good afternoon ! Good jeans, the quality is excellent, the size is right!",5,Five Stars,POSITIVE,POSITIVE,neutral,0.9642966985702515
"Levi's jeans. 501s. Button fly. Classic styling. Solid fit. Perfect color.

What more needs to be said?",5,They're...jeans.,POSITIVE,NEGATIVE,entailment,0.8149785995483398
Great classic jeans,5,Five Stars,POSITIVE,POSITIVE,neutral,0.8886058330535889
"They are Levis.  What more needs to be said?  Perfect fit, wear well, last forever.",5,Are There Any Other Jeans?,POSITIVE,NEGATIVE,neutral,0.7185943126678467
My 501s fit me perfect at first I was nervous about the fit I never order online this was the first I took a chance and I was very surprised and happy with my 501s,5,Satisfied shopper,POSITIVE,POSITIVE,neutral,0.6979334950447083
Nice fit,5,Five Stars,POSITIVE,POSITIVE,neutral,0.9046193957328796
"If you buy these, you wanted the classic button-fly... they are 501s, nuff said.",5,Five Stars,NEGATIVE,POSITIVE,neutral,0.6833126544952393
Perfect,5,Five Stars,POSITIVE,POSITIVE,neutral,0.8463523983955383
Excellent,5,Five Stars,POSITIVE,POSITIVE,neutral,0.8514291048049927
Perfect very good,5,Perfect very,POSITIVE,POSITIVE,neutral,0.7809793949127197
"Pants are great , they fit just fine. I am very pleased with them and would recommend them to anyone who might ask.  Thanks lob44",5,"Pants are great, they fit just fine",POSITIVE,POSITIVE,entailment,0.7315351366996765
Just what I wanted,5,Five Stars,POSITIVE,POSITIVE,neutral,0.9329675436019897
"I keep an eye out for these and the prices. I love the 501s, having been hooked on them back west. Can't find them in the stores here in the east. Best to watch the prices for them to drop, which they do periodically, and then grab a pair or two. They are Levi quality, so you know what you are getting.",5,"Levi's, enough said",POSITIVE,POSITIVE,neutral,0.42634451389312744
5 stars. What more can be said?,5,Five Stars,POSITIVE,POSITIVE,entailment,0.7793562412261963
My husband is a die hard Levi fan. He loves them. They are thin and won't last as long as his old ones but he likes the fit and feel.,5,My husband loves his Levi jeans even if they are thinner than ever,POSITIVE,POSITIVE,entailment,0.9242036938667297
"Nice jeans, but large",3,They don't shrink,POSITIVE,POSITIVE,neutral,0.765328586101532
Excellent all around experience  !,5,As advertised.,POSITIVE,NEGATIVE,neutral,0.7421045899391174
"After diet and exercise, I lost some weight and wanted to reward myself.  So I got 'em and I love 'em!",5,So I got 'em and I love 'em!,POSITIVE,POSITIVE,entailment,0.7258139848709106
Love it!,5,Love it!,POSITIVE,POSITIVE,neutral,0.5144116282463074
Love my jeans and they fit perfectly,5,Just perfect,POSITIVE,POSITIVE,neutral,0.7431439757347107
My husband is very satisfied with his Levi's. He says they are very comfortable. I think they look amazing on him. We are so satisfied ordering Levi's from Amazon because they have his waist & length size- hard to find in a store. We have ordered Levi's twice from Amazon and we will order more.,5,Very satisfied- ordered twice already and will order again.,POSITIVE,POSITIVE,entailment,0.9485841989517212
Love the jeans,4,Four Stars,POSITIVE,POSITIVE,neutral,0.9160715937614441
"These did not fit like my other 501's. Color, fabric different too. They are lower cut too, so they pull off when you bend over. 5'8, 170pds. 33x30. Same as other pair. I bought a plaud shirt that was cheap as can be. Tight long sleeves with huge cuffs and falling off buttons.",1,These did not fit like my other 501's,NEGATIVE,NEGATIVE,contradiction,0.9568139314651489
perfect,5,Five Stars,POSITIVE,POSITIVE,neutral,0.8144450187683105
"I purchased a pair of Levis Jeans for my dad's birthday, and he was very pleased with them. He said they fit perfectly and they arrived as expected.",5,great buy,POSITIVE,POSITIVE,neutral,0.9874876737594604
Great,5,Five Stars,POSITIVE,POSITIVE,neutral,0.8788294196128845
"I have always worn Levi 501's.  In white, black, & blue.  Skip all the trends.  You can't go wrong with the original jeans.",5,The Original & Best!,NEGATIVE,POSITIVE,entailment,0.7557100653648376
They were really long.,4,Four Stars,NEGATIVE,POSITIVE,neutral,0.5142253637313843
"Only jeans my husband will wear .
These are very nice . He is on the thin side and they fit great",5,Levi 501's,POSITIVE,POSITIVE,neutral,0.9798163771629333
Good,5,Good jeans,POSITIVE,POSITIVE,neutral,0.7070956230163574
but can i get more for a good price levis are overpriced,5,Five Stars,NEGATIVE,POSITIVE,contradiction,0.7940731644630432
Didn't know they were button fly.,4,Read description carefully,NEGATIVE,POSITIVE,neutral,0.9772822856903076
Same Levis I've Always Know,5,Good Fit,NEGATIVE,POSITIVE,neutral,0.9345986843109131
Very good,5,Five Stars,POSITIVE,POSITIVE,neutral,0.8248053789138794
as expected,5,Five Stars,NEGATIVE,POSITIVE,neutral,0.9203310608863831
"I should have ordered 33/30. 32 was too long. Tried to work a swap with you guys on the web but I could never find the return label after entering the size I wanted. As a result I have to spend $20 shorting the jeans. Also, you didn't have my color -medium stone wash only light. The rest of the jeans fit perfectly. You have to make a swap easier to do.",4,I should have ordered 33/30. 32 was too long ...,NEGATIVE,NEGATIVE,entailment,0.7301708459854126
"The Levi's Men 501 is perfect and it is fitted to me as expected so I recommend this product. However, I would like that it made by USA but unfortunately, it made in the Egypt.",5,The Levi's Men 501 is perfect and it is fitted to me as expected so ...,POSITIVE,POSITIVE,entailment,0.889208972454071
Got holes in the  Knees 2 week of wearing them.,3,Got holes in the Knees 2 week of wearing them ...,NEGATIVE,NEGATIVE,entailment,0.975692629814148
"Great pants, I didn't realize that they came with buttons instead of a zipper when I ordered them though. Fit great, good quality...a bit difficult to take a piss in.",5,No zipper,POSITIVE,NEGATIVE,entailment,0.5552534461021423
My husband loves these jeans. Great quality for the discounted price. Didn't expect the quality to be so top notch.,5,Great Quality for Price,POSITIVE,POSITIVE,entailment,0.8682346343994141
Very comfortable,5,Five Stars,POSITIVE,POSITIVE,neutral,0.8563135862350464
Great fit great price,5,Five Stars,POSITIVE,POSITIVE,neutral,0.9387381076812744
Fit just right ,5,Five Stars,POSITIVE,POSITIVE,neutral,0.9496882557868958
Nice and fit slim look.  I love 'em.,4,Four Stars,POSITIVE,POSITIVE,neutral,0.96022629737854
Ordered some black 501 jeans & they are absolutely perfect! So glad i didn't let the bad review's scare me away 39$ for a quality product! Thank you!!!!,5,501 perfection!!!,POSITIVE,POSITIVE,entailment,0.5924473404884338
I am 6 ft 190lb lean I wear 34 34 but i went for 35 33 and it did it just fine,5,"I like this pants, the style and the fit",POSITIVE,POSITIVE,neutral,0.9846258759498596
Terrible immediately shrank after the first wash,1,One Star,NEGATIVE,NEGATIVE,neutral,0.7357906103134155
I am very happy with my purchase,5,I am very happy with my purchase,POSITIVE,POSITIVE,entailment,0.9477057456970215
they fit perfect!  I love em!,5,Five Stars,POSITIVE,POSITIVE,neutral,0.9478513598442078
"This is lousy and I will not buy again.  The waist was far bigger than it was marked, and wearing them was like wearing a misshapen tent.  To add insult to the injury, washing did not shrink it.  It got bigger!  The waist is a full 5 inches larger than marked, when washing was supposed to shrink it.  Did not have any resemblance to the 501 Shrink to Fit Levis of my memory.",1,"Omar the Tent Maker, take this back!",NEGATIVE,NEGATIVE,neutral,0.8068733811378479
Fits just right,5,Five Stars,POSITIVE,POSITIVE,neutral,0.936529278755188
Great fit,4,501,POSITIVE,POSITIVE,neutral,0.5819359421730042
excelent,5,Five Stars,POSITIVE,POSITIVE,neutral,0.8588744401931763
JUST LIKE A TEEN AGER,5,GREAT LOOK AND FIT.,POSITIVE,POSITIVE,neutral,0.8158257007598877
Fit great,4,Four Stars,POSITIVE,POSITIVE,neutral,0.9526780843734741
Good,5,Good,POSITIVE,POSITIVE,entailment,0.564717173576355
Great pants but somewhat large even though I ordered the same size my husband usually wears.,5,Five Stars,POSITIVE,POSITIVE,neutral,0.9149666428565979
"I'm a longtime fan of Levi's Men's 501 Original-Fit Jean products. I only wear 501: it's a classic for all time = this is my second skin. Fabric is gorgeous. And with each wash, the jeans are just gorgeous. Only Levi's Men's 501 Original-Fit Jean and the other do not.",5,I'm a longtime fan of Levi's Men's 501 Original-Fit Jean ...,POSITIVE,POSITIVE,neutral,0.8368178009986877
I should've gotten a size larger than I normally wear,3,Too small,NEGATIVE,NEGATIVE,neutral,0.41992291808128357
Just good,5,Five Stars,POSITIVE,POSITIVE,neutral,0.8947204351425171
Excelent!,5,Five Stars,POSITIVE,POSITIVE,neutral,0.8837657570838928
Just exactly what I expected...and that's a good thing,4,and that's a good,POSITIVE,POSITIVE,neutral,0.6944935917854309
"Exact fit, great price, will buy again from this seller",5,"great price, will buy again from this",POSITIVE,POSITIVE,entailment,0.7030133605003357
These jeans are perfect fit.,5,Five Stars,POSITIVE,POSITIVE,neutral,0.9319872856140137
Great jeans.,5,Great jeans.,POSITIVE,POSITIVE,entailment,0.9314060211181641
Bought these pants to fit my Levi's jacket that I brought and I can't say I am disappointed with the quality of the pants.,5,Good Looking Pants,POSITIVE,POSITIVE,neutral,0.6885512471199036
Husband loves them!,5,Levis 5016,POSITIVE,POSITIVE,neutral,0.9329137206077576
"I've purchased two pairs of 501's in the same ""Rinse"" color recently, a 40x and a 42x.  The 42s were comfortable but a little big, so I order the 40s.  In the same length the newer 40s are TWO INCHES SHORTER in the leg compared to the other pair (that the other has already been washed and dried).  The color was also different (darker on the 40s) and the new ones are THINNER MATERIAL.  The ""better"" pair was made in Mexico, the worse pair made in Egypt.  Ordered about a month apart, sold and shipped from Amazon.",1,Junk- inconsistent!,NEGATIVE,NEGATIVE,neutral,0.9381415247917175
Great jeans,5,Great,POSITIVE,POSITIVE,neutral,0.8534402251243591
Levi 501's - comfort and fit as usual,5,Five Stars,POSITIVE,POSITIVE,neutral,0.8767830729484558
Perfect,5,Five Stars,POSITIVE,POSITIVE,neutral,0.8463523983955383
"The fly buttons fit so tightly into the holes, they are VERY  hard to fasten and unfasten. I hope they will loosen when washed.",4,Fit great,NEGATIVE,POSITIVE,contradiction,0.6512078642845154
super fit,5,Five Stars,POSITIVE,POSITIVE,neutral,0.8527440428733826
Just needs a small size,5,Five Stars,NEGATIVE,POSITIVE,neutral,0.81463623046875
I can live with the little extra room,5,Five Stars,POSITIVE,POSITIVE,neutral,0.9155193567276001
These jeans were very nice but the button rather than zip.  I was terribly disappointed.  The jeans arrived on time and was packaged well.  I would recommend them to anyone who like the buttons rather than the a zipper.,5,These jeans were very nice but the button rather than zip,POSITIVE,NEGATIVE,contradiction,0.5001417398452759
"The Levi 501 jeans sent to me were of high quality, the slightly faded blue was the color I was looking for and the fit was what I always expect from Levis.  Will definitely purchase again.",5,"Right color, right size",POSITIVE,POSITIVE,entailment,0.5101132988929749
Sent the wrong pair of jeans. Levis 541 and not the 501 as expected.,2,Two Stars,NEGATIVE,POSITIVE,neutral,0.93600994348526
Need more colors for tall folks.,3,Three Stars,NEGATIVE,POSITIVE,neutral,0.5175262093544006
excelente,5,"Muy Bueno, lo recomiendo",POSITIVE,NEGATIVE,neutral,0.5505870580673218
Good,5,Five Stars,POSITIVE,POSITIVE,neutral,0.8301262259483337
Great quality,5,Five Stars,POSITIVE,POSITIVE,neutral,0.9000826478004456
Pissed cause I couldn't return even though they are in original packaging. Legs are just too small for my thighs.,1,Pissed cause I couldn't return even though they are in ...,NEGATIVE,NEGATIVE,entailment,0.9204379320144653
Absolutely perfect,5,Wow,POSITIVE,POSITIVE,neutral,0.5816854238510132
Excelente Producto,5,Five Stars,POSITIVE,POSITIVE,neutral,0.844078540802002
Love my Levi's,5,Awesome Fit,POSITIVE,POSITIVE,neutral,0.8415964245796204
Thought they quit making these. Use to wear them in high school. Love these jeans.,5,Good Product...,POSITIVE,POSITIVE,neutral,0.6556084156036377
Not what I expected,3,Three Stars,NEGATIVE,POSITIVE,neutral,0.7816935181617737
I had to return for a bigger size.,1,One Star,NEGATIVE,NEGATIVE,contradiction,0.4935821294784546
fit nice. look good. classic!,5,Five Stars,POSITIVE,POSITIVE,neutral,0.937079906463623
For as expected very comfortable,5,Five Stars,POSITIVE,POSITIVE,neutral,0.8947069048881531
A little too long.,4,Four Stars,NEGATIVE,POSITIVE,contradiction,0.9253243803977966
501's are my go to jean. Fit great and break in for that favorite pair of jeans feel.,5,Fit great and break in for that favorite pair of jeans ...,POSITIVE,POSITIVE,entailment,0.7732724547386169
it's a bit expensive than what I bought later in a Levis store but fine with wearing earlier,5,... what I bought later in a Levis store but fine with wearing,POSITIVE,POSITIVE,entailment,0.9268801212310791
"Bought for my dad, he approves.",5,Dad approved,POSITIVE,POSITIVE,entailment,0.8642243146896362
it's ok,4,Four Stars,POSITIVE,POSITIVE,neutral,0.8621782660484314
very comfortable pants,5,Five Stars,POSITIVE,POSITIVE,neutral,0.8552843332290649
All is GREAT!!!,5,Five Stars,POSITIVE,POSITIVE,neutral,0.8377767205238342
fast delivery and good price,5,Five Stars,POSITIVE,POSITIVE,neutral,0.9667055010795593
excelent,5,Five Stars,POSITIVE,POSITIVE,neutral,0.8588744401931763
"Great fit, pleased.",5,Good levis,POSITIVE,POSITIVE,neutral,0.7469884157180786
What a complete disappointment. I had heard that 501s had changed drastically since the 80s but if you bought the rigid unwashed you got a close match. These are not close. Walmart jeans are thicker than these these are very thin and not good,2,Rigid unwashed 501 are not good,NEGATIVE,NEGATIVE,entailment,0.4356679320335388
Good,5,Five Stars,POSITIVE,POSITIVE,neutral,0.8301262259483337
They were as described and fit well.,5,501's,POSITIVE,POSITIVE,neutral,0.8842955231666565
A very enjoyable second trip. The price is much cheaper than China,5,Five Stars,POSITIVE,POSITIVE,neutral,0.9960856437683105
Ordered them 3 times happy every time,5,Five Stars,POSITIVE,POSITIVE,neutral,0.8208137154579163
Good product my husband is so happy with it,5,Very good,POSITIVE,POSITIVE,entailment,0.7183825969696045
Fit good and came on time,5,Five Stars,POSITIVE,POSITIVE,neutral,0.9857895970344543
"Great, comfortable at good price.",5,501,POSITIVE,POSITIVE,neutral,0.9532853364944458
"I goofed bought for friend wrong size so they fit my son he loves them a win
I reordered correct size
I have worn Levi's for over 50 years",5,Solid heavy duty will soften with washing,NEGATIVE,NEGATIVE,neutral,0.755272388458252
I give Levi strays thumbs up for it perfect and recommend them as very very comfortable wear jeans no doubt.  I would buy these jeans again.,5,Best pair jeans money buy.,POSITIVE,POSITIVE,neutral,0.9666164517402649
Perfect but the buttons are reallly irritating. Why not a zipper option???,3,Three Stars,NEGATIVE,POSITIVE,neutral,0.8548403382301331
Great price for true fittting jeans!,5,Five Stars,POSITIVE,POSITIVE,neutral,0.9316447973251343
They fit nicely and just as expected.,5,Five Stars,POSITIVE,POSITIVE,neutral,0.9520625472068787
Levi's are perfect.  Thank you.,5,Perfect Levi's,POSITIVE,POSITIVE,entailment,0.9213189482688904
Levi's quality.  No problems.,5,Levi's quality.  No problems.,POSITIVE,POSITIVE,entailment,0.930572509765625
Horrible quality control. Way too long.,1,Don't trust the measurements/fit or stitching,NEGATIVE,NEGATIVE,neutral,0.9735649228096008
A perfect fit.,5,Five Stars,POSITIVE,POSITIVE,neutral,0.9371347427368164
"I have a problem, I need to return these, but there was no packing slip in the box, or return labels. What do I do? thank you",1,Need to return,POSITIVE,NEGATIVE,entailment,0.9225451350212097
The only thing that I did not like was that it is a button fly jeans. I did not see that on the add until I got these in and read the add better and saw that that they were button fly jeans. Other then that they fit perfectly as all I have done was to put them on for fit?,5,The only thing that I did not like was that it is a button fly jeans,NEGATIVE,NEGATIVE,entailment,0.9888523817062378
I have always liked Levi's. Best jeans ever.,5,Great jeans,POSITIVE,POSITIVE,entailment,0.8351117372512817
Fit as expected comfortable moves with the body without binding.,5,Five Stars,POSITIVE,POSITIVE,neutral,0.9748249053955078
"Made in Egypt.
Especially the seat part is very large.",3,Seat part is large,POSITIVE,POSITIVE,entailment,0.9448645710945129
"They do seem a little lighter than back in the day and they are made in Mexico.
But perfect fit every time.",5,But perfect fit every time,POSITIVE,POSITIVE,entailment,0.7826651334762573
"One pair of slacks fit well but the second pair (same size) was too tight!  I washed both pairs in the same cold water before wearing and used low heat in the dryer.

Any thing I can do?",3,One pair of slacks fit well but the second pair ...,NEGATIVE,NEGATIVE,entailment,0.7745732069015503
"They're Levi's. Size delivered was as ordered - they fit. Delivery was made as offered. Just like the good ol' days, when you could expect to get what you wanted. What more can I say?",5,Order: 1; Problems: 0.,POSITIVE,NEGATIVE,neutral,0.8844174146652222
the expected,4,Four Stars,POSITIVE,POSITIVE,neutral,0.8016090393066406
"I love the look and feel, though it is a bit tight on the upper/mid thigh. The only thing that would make it better is if was made in the US!",4,Classic look,POSITIVE,POSITIVE,neutral,0.5707477331161499
They fit well and are very comfortable.,5,Just what I expected,POSITIVE,POSITIVE,neutral,0.9917516112327576
Thought it was zipper not buttons but I can live with it,4,Four Stars,POSITIVE,POSITIVE,neutral,0.8585711121559143
Good pants as expected,5,Five Stars,POSITIVE,POSITIVE,neutral,0.8492295742034912
They look good on him. Fit nicely.,5,Five Stars,POSITIVE,POSITIVE,neutral,0.9151957035064697
thank you very much I lovem so much just placed another order plz make sure there exactly the same color and size 42w x 32 l again u will be my new pants supplyer,5,what a deal ty just ordered another pair and will do so next month as well ty very much guys ur grear a+++++ all the way,POSITIVE,POSITIVE,neutral,0.9807717204093933
These are not real 501 shrink to fit.,1,One Star,NEGATIVE,NEGATIVE,contradiction,0.721415638923645
I didn't expect 32x34 to be four inches longer than 32x32.,3,Three Stars,NEGATIVE,POSITIVE,neutral,0.917608916759491
Just what I expected.,5,Five Stars,POSITIVE,POSITIVE,neutral,0.763447642326355
