reviewText,rating,summary,review_sentiment,summary_sentiment,hallucination,hal_score
These jeans fit verywell and are tight In all the right places and give just enough to not rub anywhere or ever be uncomfortable. Need a pair of nice white Jeans for an event these are priced right and fit very well.,5,Wear em In Comfort,POSITIVE,POSITIVE,neutral,0.6952296495437622
"If I had wanted blue burlap sack, I would have looked for it. Levi now thinks they can flog off any material on their customer. The last time I ordered these levis I got something in stripes that looked like I was escaped from prison. Now it is burlap! I will never order anything from Levi again until they come back to the original levi material. What complete junk. This product sucks.",1,New material,NEGATIVE,POSITIVE,entailment,0.6142341494560242
"Although advertised as pre-shrunk, these continue to shrink drastically, and the wrinkles are hideous.  Got two different colors, same results.  Ordered the 517's as well, and they stayed true to fit without the wrinkles.",1,Other Levi choices are better,NEGATIVE,NEGATIVE,neutral,0.9884142875671387
"I normally don't do reviews, but this time I have something helpful to say so I thought I'd share it.  The Verde Rigid is actually a Shrink to Fit jean and is not ""Pre Shrunk"" like it says here on Amazon. I bought my normal size, 30x30, washed it gentle cycle in cold water and dried in low heat. It came out super shrunk!!

Then I looked online and found this:

Made with rigid denim that you wash to a perfect fit and finish. Keep it dark and clean by washing as little as possible, or fade it with gentle washing. Will shrink approximately 10 percent; size up 1"" if waist is between 27""- 36"", size up 2"" if waist is between 38""- 48"". Increase length by 3"".

But since I am really a 30x30 and they don't make 31x33, I debated whether I should go 31x32 or 31x34. They also said somewhere if you wear boots, add an extra inch, so it would be 31x34. I don't wear boots and I wear these jeans when I ride my bike, so I decided to get 31x32. I hope they turn out cool.

Oh also, I called Amazon, and they were totally cool with it and issued me a full refund although I washed the jeans and it shrunk like crazy. They need to move this to the Shrink to Fit section.

Also, even though these jeans shrunk like crazy, they still kinda fit although they are kinda short in the inseam. They fit kinda tight, but the quality is great! They are super rigid and durable, I've never had a pair of jeans like this! I read somewhere that when you get your jeans, you should shrink them by taking off the tags, putting them on, and getting into a bathtub full of hot/cold water (depending on color of jeans and extent of fade you want). You sit there for about 30 minutes and when you get out, the water should be all blue and you will have a custom fitting jean! I will try that on my next pair instead of throwing them into the washer and dryer. Because I left them in the dryer for 2 days, they came out super wrinkly and they stay that way!! It's better for them to conform to your legs than all your other clothes in your dryer!",5,"5 Star Quality, but these are Shrink to Fit!! (Verde Rigid)",NEGATIVE,NEGATIVE,neutral,0.45375770330429077
"I've been frustrated for the last several years because it's gotten so hard to buy plain ordinary jeans for women. They're all full of fashionable features: superfluous zippers, patches, gussets, grommets, decorative stitching, little drifts of glued-on rhinestones. But at the same time, they're lacking some obvious things: belt loops, or a pocket big enough to actually hold your keys and some change. They don't come in regular blue or black; they all have weird faded patches which have been applied in special factories at enormous expense. And nearly all of them are unflatteringly, ankle-chillingly, hideously, four inches or so too short. I began to wonder if perhaps there might be some sort of vast international trouser conspiracy, run by sadistic clothing designers who sit in dimly-lit rooms waving swatches of fabric and cackling maniacally.

It finally occurred to me to try the obvious, and check out the men's department instead. I'm overjoyed to discover that men's standard Levi's 501s fit me just fine, and look the way I expect jeans to look. They have pockets, and belt loops big enough to fit a normal belt, and legs that reach all the way down to my shoes. Hooray.",5,The quintessence of pants,NEGATIVE,POSITIVE,neutral,0.8698877692222595
Excellent one from Levi's,5,Summer jeans,POSITIVE,POSITIVE,neutral,0.8624172806739807
"an oldie, but goodie.  They always fit the same.  Just what you wanted.",5,good old standard,POSITIVE,POSITIVE,neutral,0.5974869728088379
"These pants seem to be a bad copy of Levi's
Bad seams
Estos pantalones parecen ser una mala copia de Levi's
Mal acabados en general, malas costuras",1,Bad pants,NEGATIVE,NEGATIVE,neutral,0.6583864688873291
I liked very much the fibres and the way this jeans fit on me. the are for hard work and also neat look.,5,Best  jeans ever,POSITIVE,POSITIVE,neutral,0.9771174192428589
I bought a pair of these jeans from this seller a few weeks ago and am extremely happy. First off they are the only ones that offer some of the more rare finishes for this particular jean. For example the iconic rigid and new metal colors are extremely hard to find and they look extremely great. I picked a pair of both of these colors and got them for a great deal. And fast shipping too! These jeans are a must have for any classic levis 501 fan.,5,Classic Levis 501 Jeans,POSITIVE,NEGATIVE,neutral,0.5440201759338379
"Great fit for 5""9, 220 lbs",5,Five Stars,POSITIVE,POSITIVE,neutral,0.8556153774261475
Just like I remember,5,Five Stars,POSITIVE,POSITIVE,neutral,0.9516094923019409
Belt loop broke off after wearing once!!!!,1,One Star,NEGATIVE,NEGATIVE,contradiction,0.6587728261947632
I love levis 501s. I wish that there was an option on getting lega that aren't as wide. Levis are not easy for me to find in stores.,4,I love levis 501s,NEGATIVE,POSITIVE,entailment,0.9544588327407837
"on time, and as advertised, would use again",5,Five Stars,NEGATIVE,POSITIVE,neutral,0.9682613611221313
fit as listed,4,Four Stars,POSITIVE,POSITIVE,neutral,0.771270215511322
Great product at a reasonable price,5,Five Stars,POSITIVE,POSITIVE,neutral,0.9751914739608765
Don't like the way this material looks ! I feel as though it's to hard to buy these o. Line because when they get here there not like the ones I get a sears and other places!,1,Better to go to store to be able to see what the material is really going to be like .,NEGATIVE,NEGATIVE,neutral,0.9793815016746521
Everything is great!,5,Five Stars,POSITIVE,POSITIVE,neutral,0.8406856060028076
Very nice jeans.,5,Five Stars,POSITIVE,POSITIVE,neutral,0.8083508014678955
Levi's button fly fits the same as they did 30 years ago same quality been wearing Levi's jeans for 40 years,5,Quality wearability durability,POSITIVE,NEGATIVE,entailment,0.6151952743530273
"fit great, no bagging.",5,Five Stars,POSITIVE,POSITIVE,neutral,0.9646027684211731
The 29 wait was more like a 30. Not happy,1,One Star,NEGATIVE,NEGATIVE,neutral,0.5607864260673523
"Always worn levi,s. Bring it back to, united states to fit.shrinks while from shipping from the line..bring back the 529 also..",1,"Always worn levi, s. Bring it back to ...",NEGATIVE,NEGATIVE,entailment,0.8288255333900452
Nice fit,5,Five Stars,POSITIVE,POSITIVE,neutral,0.9046193957328796
Original 501 - always the best. Lasts for years.,5,Fantastic jeans,POSITIVE,POSITIVE,neutral,0.8436164259910583
"My husband loves these jeans.  They are button fly, so just be aware of that when you purchase.",5,Five Stars,POSITIVE,POSITIVE,neutral,0.9370939135551453
"I like Levis, and I got what I ordered and it was delivered on time at a good price.",5,"I like Levis, and I got what I ordered and ...",POSITIVE,POSITIVE,entailment,0.9768845438957214
Love them.,5,Great fitting jeans,POSITIVE,POSITIVE,neutral,0.9540852904319763
Pants fit as expected.  Standard quality Levis.,5,Fast shipping,POSITIVE,POSITIVE,neutral,0.9731349349021912
"Not too tight, nice fit, I'm 5'9"", 185, have a comfortable fit, rugged jean.",5,Good Fit and Quality,NEGATIVE,POSITIVE,entailment,0.5814832448959351
Same fit and style year after year. Makes for a happy husband.,5,Makes for a happy husband.,POSITIVE,POSITIVE,neutral,0.5731432437896729
The right items shipped n perfect,5,The size n color,POSITIVE,POSITIVE,neutral,0.8570712208747864
"it is very long, about 4 cm !",3,Three Stars,NEGATIVE,POSITIVE,neutral,0.5649580359458923
"Fit great..  BUT ..  The crotch ripped down the inner leg seam , I have had the Levis for just 3 months.  Very disappointed and dissatisfied!!",1,Fit great.. BUT,NEGATIVE,POSITIVE,neutral,0.6867813467979431
a,3,a,POSITIVE,POSITIVE,neutral,0.4151661992073059
Levi's is Levi's. Excellent brand,5,Excellent,POSITIVE,POSITIVE,neutral,0.6867373585700989
As expected.,5,Typical Levis,NEGATIVE,NEGATIVE,neutral,0.9422318339347839
Pants came a little rip and it came with a bad smell I wash them twice and smell is going away.,1,... came a little rip and it came with a bad smell I wash them twice and smell is going ...,NEGATIVE,NEGATIVE,entailment,0.9668267965316772
Perfect,5,Five Stars,POSITIVE,POSITIVE,neutral,0.8463523983955383
Quality perfect fit,5,Five Stars,POSITIVE,POSITIVE,neutral,0.8884528279304504
Fits perfectly and cane when expected,5,Five Stars,POSITIVE,POSITIVE,neutral,0.901168704032898
"Bought the Levi's 505 and had poor quality in every way, not sure why but returned to Costco and ordered 2 pairs of good old fashion Levi's 501's and the quality is just what I expected and just what I remembered from buying then since the 1970's. Nice to have good size range and found my rare short leg size of inseam size of 28-29. Fair price vs retail. Happy with purchase",5,Stick with quality 501's vs the 505's!,POSITIVE,NEGATIVE,neutral,0.7926462888717651
...button fly...,3,... button fly...,NEGATIVE,NEGATIVE,neutral,0.49509963393211365
I love me some Levis but when you wash them and one pant leg starts twisting as it nears your ankles and the side seam is facing the front it an unpleasant fashion flaw. Can I exchange them for a new pair???,1,I love me some Levis but when you wash them and ...,NEGATIVE,POSITIVE,entailment,0.8225971460342407
Good,5,Five Stars,POSITIVE,POSITIVE,neutral,0.8301262259483337
They fit like they did when I was wear8ng them 23years ago.,5,Five Stars,POSITIVE,POSITIVE,neutral,0.943099319934845
"They sized about one size small, which is uncomfortable. I'm going to order and other pair a size up and they should be fine.",3,fits one size small but look great and excellent quality,POSITIVE,POSITIVE,neutral,0.7582300901412964
"Im not happy at all, these so-called Levis are ridiculously light weight. I can see through the jeans and limited fabrics. I see the holes where the tags were punched through. Now I have to waste time returning which irritates me big time! There should be consequences for this type of nonsense for the crooks that allow this trying to ripoff customers. How about just giving me the item I chose & paid for!",1,Stop the nonsense!,NEGATIVE,NEGATIVE,neutral,0.8861580491065979
"Chinese crap.  NOTHING like the quality you expect from Levis.

Inside waist hem is raised and VERY rough (literally:  SHARP) and injures skin if you don't have a shirt tucked in (and even then...).

Belt loops broke about the third time I wore them.",1,Levi Strauss is spinning in his grave.,NEGATIVE,NEGATIVE,neutral,0.8176627159118652
They fit exactly like they should.,5,My trusty 501's,POSITIVE,POSITIVE,neutral,0.9378056526184082
OK,4,Four Stars,POSITIVE,POSITIVE,neutral,0.7726549506187439
These pants seemed different then most Levis. Not true to size .,1,One Star,NEGATIVE,NEGATIVE,neutral,0.6745026707649231
I buy Levi's because I like the brand but it seems like I can buy two pair one fits and the other doesn't. And what I mean by doesn't is at a half a size too big or too small so it falls off or you can't button it. I just wish there was more consistency!,3,I buy Levi's because I like the brand but it seems like I can buy ...,NEGATIVE,POSITIVE,entailment,0.9719629883766174
"First, I almost always buy Levis because they fit right, look good on me and wear well!
I did not know I was getting button fly style Levis have come around to preferring the zipper!",5,Levis are always going to look good and wear well.,POSITIVE,POSITIVE,neutral,0.8436005115509033
Buy again later,5,Five Stars,POSITIVE,POSITIVE,neutral,0.8544520139694214
Love them. This is Second pair I bought from this company & both are perfect. Was very surprised because usually have hard time getting pants that fit right. I didn't wash first pair for a long time worried would shrink to much but still fit perfect after being washed now several times. I always liked 501's but cost is prohibitive but these were cheaper than JCP & JCP Didn't have a single pair of 32/32 that I could have tried on @ the store. So I took a chance & purchased online & all worked out way better & great for Me & that's not usually the type of luck I have. So 5 stars definitely earned. Ty,5,Love them. This is Second pair I bought from ...,POSITIVE,POSITIVE,neutral,0.8512089252471924
Love them! They fit perfectly.,5,My new favorite jeans.,POSITIVE,POSITIVE,neutral,0.9908689260482788
Nice/,5,Five Stars,POSITIVE,POSITIVE,neutral,0.7233442068099976
These Levi's Jeans Look and feel and fit great.,5,Levi's Men's Big and Tall 501 Original Fit Jeans Optic White Look and feel and Fit great.,POSITIVE,POSITIVE,neutral,0.9284846186637878
just great,5,Five Stars,POSITIVE,POSITIVE,neutral,0.8669967651367188
Great fit sized right,5,True to size,POSITIVE,POSITIVE,entailment,0.8018069267272949
My husband looks hot in these jeans.,5,Five Stars,POSITIVE,POSITIVE,neutral,0.9173746705055237
Had to be returned. Defective,2,Two Stars,NEGATIVE,POSITIVE,neutral,0.6624513268470764
Classic's that just keep getting more comfortable with wear.,5,Iconic,NEGATIVE,POSITIVE,entailment,0.5219558477401733
"I loved the quality of the Jeans, the size is perfect, I recommend it 100%",5,The most important thing is quality and good service,POSITIVE,POSITIVE,neutral,0.9817644953727722
This was a gift.  This is the only jeans he will wear.,5,Great gift,NEGATIVE,POSITIVE,neutral,0.9804257750511169
These were perfect size ! could not be happier !!!,5,Five Stars,POSITIVE,POSITIVE,neutral,0.9524505138397217
Theyre the only jeans husband will wear,5,Always fit as expected,NEGATIVE,POSITIVE,neutral,0.9958051443099976
"Exactly what I expected,at a price I couldn't believe.",5,Super sale price.,POSITIVE,POSITIVE,neutral,0.7647706866264343
"It might just be my legs, but the seams around the crotch seem to wear out unreasonably quickly",4,Four Stars,NEGATIVE,POSITIVE,neutral,0.7170027494430542
nice jeans,5,Five Stars,POSITIVE,POSITIVE,neutral,0.883417010307312
Fits good,4,Four Stars,POSITIVE,POSITIVE,neutral,0.8632193803787231
"Good product,",5,Five Stars,POSITIVE,POSITIVE,neutral,0.9428477883338928
My husband loves Levis. Great fit,5,Great,POSITIVE,POSITIVE,neutral,0.7981816530227661
"Standard 501s.  Exactly what I wanted.  This model/style has been around for decades, so not
much new to say!",5,Not much new to say! Levis 501s are just fine,NEGATIVE,POSITIVE,neutral,0.9731324315071106
nothing wrong with them just did not realize that they were button fly instead of zipper.,3,Three Stars,NEGATIVE,POSITIVE,neutral,0.9186119437217712
I have to say that LEVIS 501S are my favorite jeans hands down!!!! Great price compared to MACYS laughing out loud,5,PRICE PRICE PRICE ,POSITIVE,POSITIVE,neutral,0.9631645083427429
The back belt loop broke out of the bottom stitching after only a few times wearing the pants.  I won't buy this product again.,1,The back belt loop broke out of the bottom stitching ...,NEGATIVE,NEGATIVE,entailment,0.9434499740600586
"I purchased 2 pairs of size 30 x 30 501's on amazon within the past few months.  The ""rinse"" fits normal while ""clean rigid"" has a much smaller waist size. This is more like a 28 sized waist or smaller. Not even close to the waist size of the other pair of 501's.",1,This is more like a 28 sized waist or smaller,NEGATIVE,NEGATIVE,neutral,0.4736246168613434
"I'm surprised these jeans fit as well as they do. I have experienced lots of ""hits and misses"" with Levi's sizing. These fit and feel good.",4,Nice fit,POSITIVE,POSITIVE,entailment,0.6511105298995972
Levi's 501.... good as always!,5,good as always,POSITIVE,POSITIVE,entailment,0.5028368830680847
"The shirt looks good. But a large is NOT a large. Ridiculously  small. Nothing good to say here. This was a bad ""deal"". Shame on Amazon with this one.",1,WAY TOO SMALL. A LARGE IS TOO SMALL FOR MY KID WHO WEARS A MEDIUM.,NEGATIVE,NEGATIVE,neutral,0.952549159526825
Bought my fifth pair. They fit so well. This is the standard for blue jeans.,5,Best jeans!,POSITIVE,POSITIVE,neutral,0.8715027570724487
Great fit !,5,Five Stars,POSITIVE,POSITIVE,neutral,0.9375457167625427
Thanks,5,Original,POSITIVE,POSITIVE,neutral,0.8376284241676331
My husband likes them so will order again,5,Five Stars,POSITIVE,POSITIVE,neutral,0.9726223349571228
Good fit,5,Five Stars,POSITIVE,POSITIVE,neutral,0.9264466166496277
First time buying black - always buy the 501s.  Nice to have a change in color - we will see how long they last compare to the normal jeans.  More elegant (for jeans) than the normal blue.  These were offered at a decent price.,5,Great pants.,POSITIVE,POSITIVE,neutral,0.7492600083351135
Perfect!! They fit just right..,5,Levi's Men's 501 Jean,POSITIVE,POSITIVE,neutral,0.9174790382385254
reliable levis,4,Four Stars,POSITIVE,POSITIVE,neutral,0.8726235032081604
These jeans were such a good fit!  would buy these again!,5,Great quality!,POSITIVE,POSITIVE,neutral,0.7087100148200989
We ordered 33 length and they measured 36,1,One Star,NEGATIVE,NEGATIVE,contradiction,0.5067079067230225
Way off on sizing,2,Run small,NEGATIVE,NEGATIVE,neutral,0.49492111802101135
Great,5,Five Stars,POSITIVE,POSITIVE,neutral,0.8788294196128845
"Usually biy 29 leg and were too long , had to return",2,Two Stars,NEGATIVE,POSITIVE,neutral,0.6499272584915161
Size was off,3,Wrong size,NEGATIVE,NEGATIVE,entailment,0.8803665637969971
"Well, Levi Jeans there alright I don't like the idea that they went from denim jeans to cotton jeans they don't last long they get holds between the legs in a whole week I hope Levi's go back to denim jeans they last longer than cotton jeans, I've been buying Levi Jeans for years",3,They get holes between the legs all the time,NEGATIVE,NEGATIVE,neutral,0.9360381364822388
They came wrinkled but I iron'd it out these fit perfect!,5,... came wrinkled but I iron'd it out these fit perfect!,POSITIVE,POSITIVE,entailment,0.9851699471473694
"Bought 4 months ago... both pairs the crotch blew out. To be fair, I do physical labor in these jeans. But, 4 months? Wasted my money",1,Wasted my,NEGATIVE,NEGATIVE,neutral,0.8160442113876343
product as advertised,5,Five Stars,POSITIVE,POSITIVE,neutral,0.9239524006843567
"Perfect fit, true to size.",5,Comfortable,POSITIVE,POSITIVE,entailment,0.5003443360328674
"will be Ordering again in the future for sure thanks for your Business,john,",5,Five Stars,POSITIVE,POSITIVE,neutral,0.9582386612892151
Fit as expected,5,Five Stars,POSITIVE,POSITIVE,neutral,0.9708446860313416
Five stars.,5,Five Stars,POSITIVE,POSITIVE,entailment,0.8574424386024475
"Nice jeans, they were just tighter than I expected. So I returned so I could get a more relaxed fit. Return was easy and I got my money back on an Amazon gift card that I'll use on my next order.",5,"Nice jeans, they were just tighter than I expected",POSITIVE,POSITIVE,entailment,0.7293279767036438
"My husband will only wear this brand and style of jeans. It is getting more and more difficult to find thesr in stores. Thankfully, I have found thrm here and for about $15 less a pair than in stores. I will continue to buy them here! Thank you.",4,"Men are weird, stubborn creatures.",POSITIVE,NEGATIVE,neutral,0.9907399415969849
"I don't know what is going on.  I've been buying 36"" x 36"" 501 button fly jeans for 20 years.  All of a sudden, they are an inch to big at the waste and 2"" long in length.  So I fell back and order 35x34 which are too tight.  Any thoughts, anyone?",3,"they are an inch to big at the waste and 2"" long in length",NEGATIVE,NEGATIVE,entailment,0.8463263511657715
Same great Levis!,5,Five Stars,POSITIVE,POSITIVE,neutral,0.8496859073638916
"The denim has failed (holes forming) in two spots in the crotch area. I have worn these maybe 10 times, washed maybe four times. These are not the 501s you grew up with.",1,Poor quality denim,NEGATIVE,NEGATIVE,neutral,0.8270730972290039
Levi's!,5,Great,POSITIVE,POSITIVE,neutral,0.6638319492340088
I like it,5,Five Stars,POSITIVE,POSITIVE,neutral,0.9466342329978943
"I can not believe how perfectly these 2 pair of Levi 501 jeans fit. They are in perfect condition too. The color, texture, width, length, everything!!! This is the best purchase I have ever made online for sight unseen clothing. Thank you!!!",5,They are in perfect condition too,POSITIVE,POSITIVE,neutral,0.7513597011566162
"I didn't  realize they were button fly, and it's a SNUG fit. Maybe if I was younger and could hold my gut in all day I'd wear them. They just hang in the closet. But they arrived fast and are excellent quality. If you're in good shape and want to show off you're young butt, this are the ones.",3,But they arrived fast and are excellent quality. If you're in good shape and want ...,POSITIVE,POSITIVE,entailment,0.9081769585609436
"Some things, thank goodness don't change! Same fit and quality as it did 40 years ago!",5,Five Stars,POSITIVE,POSITIVE,neutral,0.968665361404419
Love it !!!,5,Five Stars,POSITIVE,POSITIVE,neutral,0.9020199775695801
Fast Service! Done Right!!,5,Five Stars,POSITIVE,POSITIVE,neutral,0.9595692157745361
"Not the same LEVI'S :( The fit is the good ol' LEVI fit, but the material is really thin!!! I noticed the thread color was a little off before I washed them & I thought let's see how they come out of the wash. Well my husband put them on for the first time and said ""If this is what LEVI'S have come to - This will be the last pair I buy"" this is someone that has been wearing LEVI'S for 30 + years. Sure hope LEVI'S will fix this problem.",3,Just not the same ol' LEVI'S :(,NEGATIVE,NEGATIVE,neutral,0.795004665851593
"Been wearing these for over 55 years.  Still the best jeans out there.  Too many color choices nowadays, but whatever.",5,"Levi Jeans,  THE ORIGINAL BUTTON UP",POSITIVE,POSITIVE,neutral,0.909187912940979
Their quality is horrible.i can't believe there were too mang line. Place pay more attention.,3,Made in Egypt is stupid,NEGATIVE,NEGATIVE,neutral,0.8212950229644775
very good,4,Four Stars,POSITIVE,POSITIVE,neutral,0.8379331827163696
Compare with my current 510 the butt and thigh a about an inch wider.,3,Three Stars,NEGATIVE,POSITIVE,neutral,0.7769795656204224
"These r typically some of th best damned jeans u'll ever wear, and Sheppler's is one of th most dependable suppliers u'll ever deal with when getting them. Th End.",5,Levi 501 Botton flys.,POSITIVE,POSITIVE,neutral,0.9323845505714417
Fit as expected,5,Quality is in the product,POSITIVE,POSITIVE,neutral,0.8418132066726685
"Levi's 501 prewashed jeans are the best, most rugged regular jeans you can buy! Great price on Amazon too!",5,Great Value!,POSITIVE,POSITIVE,neutral,0.7771334052085876
"I decided to try this style as a change.  My mistake.  After a month of wearing them, I've found the button fly is difficult to unbutton and re-button.  Otherwise, the pants fit well and wear well.",3,"Good fit, good wear, but the button fly is too hard to button and un-button",NEGATIVE,NEGATIVE,entailment,0.9858558773994446
"I ordered these 501 jeans for my husband, their the only jeans he wear, they  arrived earlier than expected.
My husband really love the color, clean rigid and they fit him nicely. A very satisfied customer.
Thank you Amazon ",5,My husband really love the color,POSITIVE,POSITIVE,neutral,0.942463219165802
"I've ordered jeans on her before, same size waste and same size length. But these particular ones seem to be a little long in the length than my previous orders. It's highly possible that these are knock-offs do to the fact that I've bought other pairs of the same jeans and same color from chain retail stores. And the jeans purchased from the retail stores fit the way they are supposed to. But for the price it's a pretty good deal.",3,The length isn't quite right,POSITIVE,NEGATIVE,entailment,0.5957688093185425
It is the same as always and perfect for my husband.,5,Five Stars,POSITIVE,POSITIVE,neutral,0.9299147129058838
excelent,5,Five Stars,POSITIVE,POSITIVE,neutral,0.8588744401931763
"I bought this for my hubby, these fit true to size and make his azz look hot while not being flashy.",5,Your buttocks will look better in these.,POSITIVE,NEGATIVE,contradiction,0.5126065015792847
"Did not meet my expectations, I miss better finished in the pages of the buttons.",3,I miss better finished in the pages of the buttons,NEGATIVE,NEGATIVE,entailment,0.9708719253540039
One of the pairs fits too tight in the thigh and is the exact same size as the other pair I bought.,1,One of the pairs fits too tight in the thigh ...,NEGATIVE,NEGATIVE,entailment,0.9674395322799683
"Great as usuallove these Jeans. Delivered on time, and no hassle. Price great yoo",5,Five Stars,POSITIVE,POSITIVE,neutral,0.9394395351409912
Just as I remember!,5,Five Stars,POSITIVE,POSITIVE,neutral,0.8865522742271423
"Just what I wanted and fast delivery!
Thanks!!",5,What I wanted and at a good price!,POSITIVE,POSITIVE,neutral,0.9942629933357239
Seem to be larger that stated,4,Four Stars,POSITIVE,POSITIVE,neutral,0.8506945371627808
