reviewText,rating,summary,review_sentiment,summary_sentiment,hallucination,hal_score
Good looking jeans,5,Five Stars,POSITIVE,POSITIVE,neutral,0.8974835276603699
"It fits just perfect ,I love it",5,Five Stars,POSITIVE,POSITIVE,neutral,0.9470897912979126
the label on the  outside is wrong seems counterfit,3,the label on the outside is wrong seems counterfit,NEGATIVE,NEGATIVE,entailment,0.9852092862129211
"I had to give one star because no zero available. I bought before reading reviews. They are correct! Not the Levis you remember. My cheap Coscto jeans are better. I haven't had the need to buy jeans for a long time because my old Levis were soo awesome. These were not. Sized wrong, very thin feeling. Don't waste your time. Very very dissapointed.",1,Cheap cheap cheap,NEGATIVE,NEGATIVE,neutral,0.4350670576095581
"Levis 501. Whats not to like. Classic fit. Probably could have got 1 size smaller, but fit just fine with a belt.",4,Will change color slightly after first wash,POSITIVE,POSITIVE,neutral,0.9933955073356628
Size no consistent with other 501's I have purchased in the past. Also material seems to be thinner.,2,Two Stars,NEGATIVE,POSITIVE,neutral,0.6426342725753784
fast delivery and fits perfectly!! love them,5,fit perfectly,POSITIVE,POSITIVE,neutral,0.6390776038169861
"All very well, delivery very fulfilled. The pants are a bit heavy",4,Four Stars,POSITIVE,POSITIVE,neutral,0.9670278429985046
niceeeee,5,Five Stars,POSITIVE,POSITIVE,neutral,0.8483020663261414
The jeans fit perfectly but they seemed a little too washed out for them to be dark,4,Four Stars,NEGATIVE,POSITIVE,neutral,0.8820691108703613
Love that I can finally find his size!!! 42x36 it is so hard to find long inseams. Came quickly and are exactly as expected.,5,Great Levis,NEGATIVE,POSITIVE,neutral,0.6435720324516296
Perfect,5,Five Stars,POSITIVE,POSITIVE,neutral,0.8463523983955383
Good,5,Five Stars,POSITIVE,POSITIVE,neutral,0.8301262259483337
Look like a Levi's first quality product.,5,Five Stars,POSITIVE,POSITIVE,neutral,0.8603113889694214
"First off I will like to say the pants I received were definately washed and returned in the past. The item was described as new 501 Levis and as we all know, 501s are shrink to fit. Having said that I have to say the pants was received in good condition (not new) and was acceptable for the simple fact that I am a tall man and tall sizes are hard to find in retail stores. So for that reason alone I decided to keep the pants, otherwise I would have returned them...Overall I can only assume this was not done intentionally but still a lil bit misleading.",2,Item Not As Described,NEGATIVE,NEGATIVE,neutral,0.6928342580795288
Great price for a pair of Levis. Perfect fit and shipped in a few days.,5,Five Stars,POSITIVE,POSITIVE,neutral,0.9772725105285645
lifetime 501 only,4,Four Stars,POSITIVE,POSITIVE,contradiction,0.5777428150177002
Perfect!,5,Five Stars,POSITIVE,POSITIVE,neutral,0.8201385736465454
Happy with purchase. I can reccommend.,5,Five Stars,POSITIVE,POSITIVE,neutral,0.8754058480262756
Great jeans...fit just like they are supposed to fit!,5,Five Stars,POSITIVE,POSITIVE,neutral,0.9517872929573059
"Fast delivery, perfect fit will be buying more",5,perfect fit will be buying,POSITIVE,POSITIVE,entailment,0.7760315537452698
"Jeans did not have any labels of a new item. It looked like it was worn before. Plus, it is totally not true to size, and, unfortunately, I cannot fit in them. I wear 33x34 always.",2,It looked like it was worn before,NEGATIVE,NEGATIVE,entailment,0.722461998462677
Fits as expected & my husbands is satisfied,5,Five Stars,POSITIVE,POSITIVE,neutral,0.9388256669044495
Love them!,4,Four Stars,POSITIVE,POSITIVE,neutral,0.9033834338188171
"fast delivery, jeans are excellent",5,Five Stars,POSITIVE,POSITIVE,neutral,0.9393833875656128
My husband wears Levis 501 during last 10 years. This means is exactly what he wanted. The size fits excellent.,5,The size fits excellent.,POSITIVE,POSITIVE,entailment,0.729155957698822
I have wanted a pair for a long time I love them only downside is the buttons don't seem as sturdy as they once were.,5,... have wanted a pair for a long time I love them only downside is the buttons don't seem as ...,NEGATIVE,NEGATIVE,entailment,0.9895405173301697
Like em but gotta return them. Too small...,3,Three Stars,NEGATIVE,POSITIVE,neutral,0.6670936346054077
I love the way men's 501 original fit jeans fit! I like the way they sit on my hips. Thank you for sending them to me.,5,I love the way men's 501 original fit jeans fit,POSITIVE,POSITIVE,entailment,0.9545391201972961
Bought these as a gift for my friend.,4,Four Stars,POSITIVE,POSITIVE,neutral,0.9444282054901123
Umm yea!  They are the iconic Levis 501 button fly. You cant go wrong.,5,Umm yea! They are the iconic Levis 501 button ...,POSITIVE,POSITIVE,entailment,0.6442788243293762
Good fit,5,Five Stars,POSITIVE,POSITIVE,neutral,0.9264466166496277
Consistent sizing and good price.,4,Consistent sizing,POSITIVE,POSITIVE,entailment,0.510520875453949
"I really want to give more than one star, but for some reason these jeans are missing an entire loop at the waist band. They fit good, just I've never seen this before...and I used to work for Levis Strauss. Very strange. Very defective.",1,Defective Pair,NEGATIVE,NEGATIVE,entailment,0.6718631386756897
Unless your legs are very twig like these jeans are not for you.,1,One Star,NEGATIVE,NEGATIVE,neutral,0.7191417813301086
Nothing to add.,5,Five Stars,NEGATIVE,POSITIVE,contradiction,0.9738634824752808
Levi 501 button fly my favorite pair of jeans. Very comfortable. Well made as always. I will be buying more!!!,5,~good Levi jeans~,POSITIVE,POSITIVE,neutral,0.906533420085907
I love the Levi's fit and light stonewash color - fantastic jeans!,5,Can't Beat Original 501's!,POSITIVE,NEGATIVE,neutral,0.7137481570243835
"I purchased these for my husband for Christmas, he wore them maybe 5 times, the belt loop tore off and the Levi logo on the back pocket fell off. Im not really sure if these are authentic since Levis are made better than that. The return window is closed and he is stuck with these.",1,Fake Levis?,NEGATIVE,NEGATIVE,neutral,0.7137090563774109
not even close to the fit of other Levi's,3,Three Stars,NEGATIVE,POSITIVE,neutral,0.9561541676521301
Your new favorite jeans,5,Five Stars,POSITIVE,POSITIVE,neutral,0.8524696230888367
Happy with my order. Will order again when I need some more.,5,Five Stars,POSITIVE,POSITIVE,neutral,0.9291444420814514
"Ordered Shrink to Fit 501 original jeans. Washed. Did not shrink. These are pre washed 501, used to be marked 502! Have to wonder if this was a bait and switch or possibly imitations, not true Levi brand.
Will not order Levi jeans from Amazon again. A very expensive mistake!",1,To receive what was advertised by Amazon vendor!,NEGATIVE,NEGATIVE,contradiction,0.9685728549957275
Good pair of pants fits well,5,Five Stars,POSITIVE,POSITIVE,neutral,0.9654222726821899
Ok but I will go a size up next time,5,Five Stars,POSITIVE,POSITIVE,neutral,0.7873410582542419
Every pair fits a little different,3,Fit in a good pair of jeans,POSITIVE,POSITIVE,neutral,0.878065288066864
Great I love them! Just as I hoped!,5,Five Stars,POSITIVE,POSITIVE,neutral,0.8850822448730469
They fit great!,5,They fit great!,POSITIVE,POSITIVE,entailment,0.9600010514259338
Perfect fit. Classic style.,5,Five Stars,POSITIVE,POSITIVE,neutral,0.8794385194778442
"I have a pair of 34-34 501s that are just going in the knee so I bought another pair from here to replace them.  It says 34-34 on them but I couldn't even button up the fly, let alone the top button.  These were RIDICULOUSLY small.",1,I have a pair of 34-34 501s that are just ...,NEGATIVE,POSITIVE,entailment,0.7711381912231445
I revived fake Levis 501 Jeans,1,Authenticity,NEGATIVE,POSITIVE,contradiction,0.7623565196990967
"501's! I thought.  Bring back the 80s!  I thought.  Now I just need a Don Johnson jacket and Capezio's I thought.  I was so excited to get 501's that I was absolutely DISGUSTED when the back right belt loop RIPPED away from the jeans leaving a hole on their FIRST wear during which time I did nothing strenuous.  Do not be fooled, this is not the same company that used to make great jeans and they have no business charging what they do for them.  I have a garbage pair of store-brand Target jeans that has lasted 10 years!  I am intensely disappointed and won't buy Levi's again.",2,Inexcusably low quality.,NEGATIVE,NEGATIVE,neutral,0.6542788147926331
Did not realize it is a button fly. Fits my husband well.,4,Four Stars,POSITIVE,POSITIVE,neutral,0.8369630575180054
"The original, what more can I say!",5,Five Stars,POSITIVE,POSITIVE,neutral,0.9184560179710388
fast delivery and fits well.,5,Five Stars,POSITIVE,POSITIVE,neutral,0.9753572940826416
"I had not worn 501s for 40 years.  I bought one pair, and they fit so well I bought 2 more pairs. And equally important, all 3 pairs were constructed without a flaw.  505s will just have to share space in the closet.",5,Great fit and very comfortable!.,POSITIVE,POSITIVE,neutral,0.7936496734619141
My waist is size 32...I always buy 501s in size 34 waist as I did with these and they were too tight in the thighs. I believe a 36 would be too big in the waist. Ive purchased 501s before in size 34 waist from a Levis store and I had no problems. Im not sure if these were just the wrong cut or I need to look outside of the 501 model,3,My waist is size 32... I always ...,NEGATIVE,POSITIVE,entailment,0.8802274465560913
"Nice fit, I've been wearing 501s for over 50 years.",5,Five Stars,POSITIVE,POSITIVE,neutral,0.9510478377342224
on time and as described,5,Five Stars,POSITIVE,POSITIVE,neutral,0.9415748715400696
These jeans are a Thin  material not as heavy as Id like,3,These jeans are a Thin material not as heavy as ...,NEGATIVE,NEGATIVE,entailment,0.954239547252655
The product was fine but too small.  I was disappointed that I had to pay more when I exchanged it for a different size.,3,Exchange cost me money,NEGATIVE,NEGATIVE,entailment,0.9399915933609009
"Fits great.  I love 501 black Levis.  501s are the best pants that I have ever owned.  Great look.  If in doubt, and they are on sale, go for it, and treat yourself to a pair.  Theyre awesome!",5,Best pants you can get!,POSITIVE,POSITIVE,neutral,0.8380352258682251
"Love these jeans, although I did mess up and get the button fly instead of a zipper.  I decided to keep them anyway.  Getting used to the buttons.  LOL",5,Great fitting jeans,POSITIVE,POSITIVE,neutral,0.7822675108909607
"They fit expected. Nice jeans, this is my second pair",5,"Nice jeans, this is my second pair",POSITIVE,POSITIVE,entailment,0.9619585871696472
I have ordered thes pants in blue and back. The. Black were much smaller than the blue. I had to order the next larger size and they fit snugger than my blue ones.,4,Black need to be ordered a size up,NEGATIVE,NEGATIVE,neutral,0.7798938155174255
Perfect fit,5,Perfect fit,POSITIVE,POSITIVE,entailment,0.6289992332458496
"It's not Amazon's fault.

Levi's has myriad different levels of quality, now. 501's are *not* what they were when one could only buy the ""raw"" cloth type, and had to wash 'em five times before they were comfortable. Levis, especially 501s, are best purchased in a brick-and-mortar store, preferably a high-quality one, than they are on-line. We've found some great buys at stores where we could examine the merchandise.

Late to the party with this review. The pair I bought from Amazon has recently worn out; as a hole appeared in a rather compromising (crotch) part of the pants. Not like the Levi's I know and love... I threw them away, and it made me feel wasteful.",2,and had to wash 'em five times before they were comfortable. Levis,NEGATIVE,NEGATIVE,neutral,0.8052210807800293
Good Quality Jeans,4,Good Quality,POSITIVE,POSITIVE,entailment,0.7234891057014465
Super easy to find the wash and size needed at a decent price.,5,Five Stars,POSITIVE,POSITIVE,neutral,0.9748879075050354
Levis always fit well. And look great.,4,Fit,POSITIVE,POSITIVE,entailment,0.48357754945755005
Nice enough Levi's even though they are not made in America any longer.,4,Four Stars,POSITIVE,POSITIVE,neutral,0.9673027396202087
All great,5,Five Stars,POSITIVE,POSITIVE,neutral,0.9193235635757446
Great!,5,Five Stars,POSITIVE,POSITIVE,neutral,0.8449100852012634
"I've been wearing 501s for a couple of decades and after this pair of jeans I'm done. The cut is different (more skinny jean like), sits too low and the fabric feels super thin and soft. I'm not some hip California kid, just a regular guy who really liked my normal 501s. I'd own two to three pair the newest of which might get worn to the office on a Friday and the older ones used for outdoor work. This new 501 is no good for either. Too low to wear to the office. Too thin of material to have any chance of standing up to any actual use.",1,New cut. New material. I do not like.,NEGATIVE,NEGATIVE,entailment,0.9634024500846863
"PRODUCT WAS PERFECT, GOT THE ITEM FAST, AMAZON THE BEST",5,Five Stars,POSITIVE,POSITIVE,neutral,0.9626190662384033
"Prefer the stretch fit, otherwise it was fine.",4,otherwise it was fine.,POSITIVE,POSITIVE,entailment,0.7028513550758362
Although it fit well I ordered blue and got gray. You should not show something that is not available. Delivery was great but it is not what I ordered. I wanted regular original and they only came in blue. The load of pictures of every shade imaginable and most of them being unavailable does you no good.,1,I ordered blue and got gray. You should not show something that is not available.,NEGATIVE,NEGATIVE,entailment,0.9826005101203918
Awesome product,5,Five Stars,POSITIVE,POSITIVE,neutral,0.9323472380638123
"noway were the sizes selecteed right...34 inch waist would not close,,,,legs tight,,,what a waste of money,,sent to my son and he was disappointed",1,misfit,NEGATIVE,NEGATIVE,neutral,0.9734029769897461
a classic fit...,5,Five Stars,POSITIVE,POSITIVE,neutral,0.8455163836479187
Great 501's as always,5,Five Stars,POSITIVE,POSITIVE,neutral,0.8933666944503784
"Nice color, really thick/sturdy denim.... but far, far, far too small... not even close to the size advertised / labelled.  Have to return.

I've worn the same size/style 501 jeans for years. I held these up against my current pair (freshly washed/shrunk) and these were a full two inches smaller than the ones I currently own.

Should have read the other reviews about the sizing issues and ordered one size bigger.

Luckily, there are free returns on my purchase so I can send them back.",1,Much smaller than labelled / advertised.,NEGATIVE,NEGATIVE,entailment,0.7624776363372803
Excellent!!,5,Five Stars,POSITIVE,POSITIVE,neutral,0.8444646596908569
just getting back to smaller size these are a little snug in the callves but I'm sure they will fit nice soon,5,... in the callves but I'm sure they will fit nice,POSITIVE,POSITIVE,entailment,0.8652682900428772
Fit way too tight and not like regular Levis usually a 34/30 fits fine!!!,1,They run smaller!! Get a size up,NEGATIVE,NEGATIVE,neutral,0.933266818523407
"Perfect, as labeled, original 501's...",5,Five Stars,POSITIVE,POSITIVE,neutral,0.8225458264350891
"The jeans are great, I got the wrong fit for myself, nothing wrong with the product whatsoever",5,Five Stars,POSITIVE,POSITIVE,neutral,0.5302661061286926
Fits as they are supposed to. Just wish Levi's were built as good as in the past.,4,Fit is correct.,POSITIVE,POSITIVE,entailment,0.913212776184082
Didn't realize these were all Button flies. I feel as though my head was in the sand I guess. I need to return these>,3,Didn't realize these were all Button flies. I feel ...,NEGATIVE,POSITIVE,entailment,0.9567751884460449
Not the quality of the older 501's but that could just be me.  My partner's favorite style of jeans and he looks great!,4,My partner's favorite style of jeans and he looks great,POSITIVE,POSITIVE,entailment,0.8201014995574951
Levi's never disappoint.,5,Five Stars,POSITIVE,POSITIVE,neutral,0.8847387433052063
I'm a first-time buyer of Levis online. Amazon has really impressed me again. I knew the quality of denim as expected. I was not disappointed! Thank you for making this purchase a success. There are no retailers in my area that carry my choice of jeans. Now I know I can trust Amazon when purchasing denim in the future. Thank you very much!,5,I was not disappointed! Thank you for making this purchase a success,POSITIVE,POSITIVE,entailment,0.8706742525100708
His favorite.,5,Five Stars,POSITIVE,POSITIVE,neutral,0.8786729574203491
Fit a little tight for me will pass to my grandson,4,Four Stars,POSITIVE,POSITIVE,neutral,0.7957742214202881
There great i love them!,5,Five Stars,POSITIVE,POSITIVE,neutral,0.8219114542007446
"Love the Levis. Why buy them anywhere else? Arrived on time, fit perfect, color is as expected. And the price is great. Will order again when needed!",5,Love the Levis,POSITIVE,POSITIVE,neutral,0.7391610741615295
"My Dad has been a Levis fan since the 70's, and i thought that he would really appreciate these as a present. He was asking for new jeans for awhile, and he hadn't had a good, decent pair of Levis in so long. As soon as he opened these he put them on and said ""These feel the same as the ones I had when I was 18"" and THAT is why I got them, for that reaction. Levis are such a great brand, the 501's are a classic, thoughtful gift to any hard working Dad like mine who deserve that kind of nostalgia",5,"Classic Fit, Reliable Brand",POSITIVE,POSITIVE,neutral,0.8395453691482544
"Great jeans, perfect fit and delivered to the doorstep!",5,Five Stars,POSITIVE,POSITIVE,neutral,0.9605435132980347
"Classic 501s-- they look, fit, feel just as they should,  as they always do",5,Five Stars,POSITIVE,POSITIVE,neutral,0.926407516002655
Very comfortable and a fit as expected.,5,Five Stars,POSITIVE,POSITIVE,neutral,0.9516891837120056
Good jeans for the price point.,5,Five Stars,POSITIVE,POSITIVE,neutral,0.9414851069450378
I didn't realize the pre washed Levis shrink less than the original unwashed ones.  Next time I'll look for the unwashed ones.,4,I didn't realize the pre washed Levis shrink less than ...,NEGATIVE,NEGATIVE,entailment,0.8429380059242249
Hubby likes them!  They fit good and the price was right.,5,Nice Jeans,POSITIVE,POSITIVE,neutral,0.8407270312309265
"After 1 wash, some stitching came open on the side below the pocket, about 2 inches.  I did not expect this from Levi's. I guess they do not make them how they use to. Now I have to get them repaired by someone, it will take to long to mail them back.",3,"Fit good, not made like they used to be.",NEGATIVE,POSITIVE,neutral,0.7750661969184875
They didn't fit super disappointed,1,They didn't fit super disappointed,NEGATIVE,NEGATIVE,entailment,0.9201374650001526
"I discovered this cut of Levis around 2009 and haven't switched since. I find the fit snug, however I may be giving myself too much credit with my waistline when choosing my size. I prefer the tight pants however, and for me these fit perfectly. Amazon usually has the cheapest price, and if you have freakishly short legs like myself you can get shorter lengths not usually carried at retailers.",5,and if you have freakishly short legs like myself you can get shorter lengths not usually carried ...,POSITIVE,NEGATIVE,neutral,0.962690532207489
They don't fit like regular 501s you buy at the store for some reason. They run small.,2,Two Stars,NEGATIVE,POSITIVE,neutral,0.6843491196632385
In the rare occasion I'm not wearing Carhartts these are what I wear. Casual and fit well,5,Levi's pants are awesome.,POSITIVE,POSITIVE,neutral,0.606204628944397
I'd give it 5 stars if it was made exactly like the 501s commonly available in the USA back in the 1970s. Attention to detail was lacking in this modern imported example. Otherwise a rugged and serviceable pair of denim pants.,4,... give it 5 stars if it was made exactly like the 501s commonly available in the USA back in ...,NEGATIVE,NEGATIVE,entailment,0.9907841682434082
Fits perfectly great and at a great price!!!,5,Perfect fit!,POSITIVE,POSITIVE,entailment,0.9757760167121887
"Good price and fit as expected.  Washed well, not a lot of shrinkage.",5,"Good price for 501""s",POSITIVE,POSITIVE,neutral,0.9837471842765808
"The waist and length were accurate, but your legs better be made of sticks, or they will act as tourniquets about mid-thigh.",1,"Odd dimensions, maybe they're supposed to be skinny jeans for tall people?",NEGATIVE,NEGATIVE,contradiction,0.9486398696899414
Love 501's.  I've been wearing them since college (and that's been a while).,5,Man's best jeans.,POSITIVE,POSITIVE,neutral,0.9275760054588318
Classy and chic,5,Just call me Alejandro Sosa,POSITIVE,POSITIVE,contradiction,0.4947810471057892
I've been wearing button fly 501 jeans as far back as I can remember and love the fit. Wish the denim was as thick as it used to be.,5,... jeans as far back as I can remember and love the fit,NEGATIVE,POSITIVE,entailment,0.9496130347251892
The fit is great.,5,Five Stars,POSITIVE,POSITIVE,neutral,0.9402755498886108
No complaints,5,Five Stars,POSITIVE,POSITIVE,neutral,0.7981894612312317
Fits perfect on my husband,5,Five Stars,POSITIVE,POSITIVE,neutral,0.956008791923523
"Well, ordered these because I have exactly the same size. Consequently, knew precisely what I was getting. Whats not to like?  ",5,Whats not to like? ,POSITIVE,POSITIVE,neutral,0.5530359745025635
Love the original button fly 501 jeans there is nothing like them!,5,Love the original button fly 501 jeans there is nothing like them!,POSITIVE,POSITIVE,entailment,0.9622800350189209
These were exactly what I was looking for and for a reasonable price.,5,501's right!,POSITIVE,POSITIVE,neutral,0.6774275302886963
Love these jeans !!,5,Five Stars,POSITIVE,POSITIVE,neutral,0.9342042803764343
"He has no butt, so jeans are difficult, these fit him well and look great on him.",5,They fit the Buttless guy.,POSITIVE,POSITIVE,entailment,0.9791020750999451
The pants were marked as the size I ordered (32 inch waist) but they are actually 34 inches.,1,"Too big, Size not as marked.",NEGATIVE,NEGATIVE,neutral,0.5868624448776245
Great!,5,Five Stars,POSITIVE,POSITIVE,neutral,0.8449100852012634
Timeless classic. Lots of choice in terms of fit and sizing. Staple semi-formal office wear for me.,5,Timeless classic..,POSITIVE,POSITIVE,contradiction,0.8297141194343567
No problems.,5,Five Stars,POSITIVE,POSITIVE,neutral,0.6497988700866699
"Convenience
Dislike pricing",4,Convenience Dislike pricing,NEGATIVE,NEGATIVE,entailment,0.7550548315048218
"Tight at first, but after a wash and wearing they settle in. Buttons are a little hard to unclasp, but they get easier.",5,"Tight at first, but after a wash and wearing ...",NEGATIVE,NEGATIVE,entailment,0.8499128818511963
"Great fit, very comfortable!!!",5,Very comfortable,POSITIVE,POSITIVE,entailment,0.9123879671096802
I've worn the same size of this Levi's style for years and they fit fine. However the bottom 2 buttons were very hard to button. I had to do both of them while not wearing them. Almost had to use a pair of pliers to button them. Then I put the pants and was able to button the top 3 without any problem. Fortunately I can just keep the bottom 2 buttoned and get the pants on and off.,4,"Fit well, but not all buttons worked",POSITIVE,NEGATIVE,neutral,0.6528606414794922
Great weave and durability! My husband looks fantastic (hot!) in these!,5,Five Stars,POSITIVE,POSITIVE,neutral,0.9488233327865601
good price,5,Five Stars,POSITIVE,POSITIVE,neutral,0.9151315093040466
I love these jeans and have bought them for years.  I only wish Levi made a jean like them that fit this well and have a ZIPPER fly.,5,Fit Great,POSITIVE,POSITIVE,neutral,0.4744391441345215
They don't fit quite like the other 501 jeans I bought from Amazon,3,Three Stars,NEGATIVE,POSITIVE,neutral,0.9826995134353638
"Siempre fui fans de Levis, pero estos Jeans se pasan, parecen lona de circo ",1,One Star,NEGATIVE,NEGATIVE,neutral,0.5813260674476624
Great quality and fitting,5,Material and endings high level,POSITIVE,POSITIVE,neutral,0.8262993693351746
I love my Levi jeans and these are no exception. Fit as expected and high quality and durable.,5,Great jeans!,POSITIVE,POSITIVE,entailment,0.8709414005279541
Perfect fit for not trying them on first!,5,Perfect fit!,POSITIVE,POSITIVE,entailment,0.8596329092979431
"I am withholding a review since I prefer a zipper front not button up.  I have searched for a zipper front, 42 x 34, with no luck.  Once my month is up, i guess I'll be stuck with them.",3,I am withholding a review since I prefer a zipper ...,NEGATIVE,NEGATIVE,entailment,0.8499675989151001
To small for my husband. He wound up ripping out the crotch area.,2,Two Stars,NEGATIVE,POSITIVE,contradiction,0.5842413306236267
Fits nice. Very comfy.,5,Five Stars,POSITIVE,POSITIVE,neutral,0.9188223481178284
Levis 501 doesnt need my review that will say that this is the best jeans ever!!,5,501 - enough said !,POSITIVE,POSITIVE,entailment,0.8133698105812073
Love 501. Size chart helped me get the right fit! So happy. Will reorder again.,5,Five Stars,POSITIVE,POSITIVE,neutral,0.9622305035591125
Great quality and last for years. I would highly recommend levi 501 pants. I've bought two pairs that have lasted me 3 years and still ware them.,5,Awesome pants,POSITIVE,POSITIVE,entailment,0.5142025947570801
Whats there not to like I've been Levi wearer all my life.,5,Five Stars,NEGATIVE,POSITIVE,neutral,0.8557586073875427
"The same size, I can put on lee's pants but ur pants I can't get in",2,Two Stars,NEGATIVE,POSITIVE,neutral,0.7273815274238586
"Since I have worn these jeans for years, fit was right on and the delivery from Amazon worked very well for me..",5,"Since I have worn these jeans for years, fit ...",POSITIVE,POSITIVE,entailment,0.9190500378608704
Awesome!,5,Five Stars,POSITIVE,POSITIVE,neutral,0.754497230052948
