reviewText,rating,summary,review_sentiment,summary_sentiment,hallucination,hal_score
I have not ever written a bad review for any item received on Amazon but I couldn't let this go. These 501s are the worst purchase ever. I cannot believe how cheaply made they are. I've worn 501s all my life (54)years and never have I had a pair like these. THIN. They were a little tight then after I washed them I couldn't even get them on. All my other pairs fit fine so it is not the post Thanksgiving swelling. I will never buy Levis online again. If you must buy these levis get them at least 2-3 sizes larger in the waist and 2 sizes longer than you normally wear. I wouldn't expect them to last more than a few months of washing because of how thin they are made. I am wholeheartedly saddened if this is the quality that Levis has sunken  to. Hopefully I can return them and get something else.,1,I have not ever written a bad review for any item received on Amazon but I ...,NEGATIVE,POSITIVE,neutral,0.7176064252853394
As advertised.  Great product.,4,Great product.,POSITIVE,POSITIVE,entailment,0.8009287118911743
Love this jeans!!,5,Five Stars,POSITIVE,POSITIVE,neutral,0.9306033849716187
"Finally got these. Took a lot of work...not delivered on the first go through, so I did not have them for the intended trip. But when they finally arrived after refunding and reorder...they WERE Levi Button fly 5Oh1 jeans https://www.amazon.com/dp/B00214WRF4/ref=cm_cr_ryp_prd_ttl_sol_3. Unparalleled. Jeans so good that even after THAT curfluffle, they only lost one star. Perfect fit in all directions.",4,Jeans so good that even after THAT curfluffle,NEGATIVE,POSITIVE,neutral,0.8424021601676941
"Couldn't find 501s at all in my closest kohls store. None. The clerk said Oder them on line. Kohls usually won't accept coupons on,Levi's products anyway. So no deal there. Went to Amazon and the selection was spectacular. Found exactly what I wanted I and had them in 1 and a half days. Just in time to wear to out of town holiday trip! Omg no wonder department stores are closing right and left. I love my kohls store but the jeans were 39.95! Way less and no hassle. Macy's another option I left several years ago after Lazarus was absorbed. Service lousy stores messy. Mr. Lazarus would never approve. Thanks Amazon.",5,I love my kohls store but the jeans were 39,NEGATIVE,POSITIVE,entailment,0.8696767687797546
Loyal to 501 for 25 years.,5,Five Stars,POSITIVE,POSITIVE,neutral,0.9021526575088501
my favorite pants,5,Five Stars,POSITIVE,POSITIVE,neutral,0.9047462344169617
"Hey man I have been wearing Levise 501 last 55 maybe close to 60 years of my life what are you talking about man?
always 501 thanks a lot good product",5,always 501 thanks a lot good,POSITIVE,POSITIVE,entailment,0.7713027596473694
Love the fit and comfort of these original 501 jeans. My favorites.,5,Five Stars,POSITIVE,POSITIVE,neutral,0.972579836845398
don't like buttons instead of zipper,4,Four Stars,NEGATIVE,POSITIVE,contradiction,0.7960739731788635
As good as they were 50 years ago,5,timeless,POSITIVE,POSITIVE,neutral,0.9097423553466797
Perfect,4,Four Stars,POSITIVE,POSITIVE,neutral,0.805692195892334
Fit as expected,5,Five Stars,POSITIVE,POSITIVE,neutral,0.9708446860313416
"I have been buying Wranglers because they are cheap. Some last over a year. Others have something like a belt loop failure after 6-12 months. It's a little annoying, but I figure that's what you get for buying cheap jeans.

Recently I decided to splurge and get a pair of Levi's. They looked great and fit great. Since they were my ""fancy"" jeans, I did not wear them for yard work or anything, just two days sitting at a desk and one wash every week.

Imagine my surprise when, after six weeks, the belt loop failed! About two weeks after the return window closed.

I suppose I will figure out some way to patch them, but they sure aren't my ""fancy"" jeans any longer.

I thought I could buy more expensive (assuming higher quality) stuff and buy and discard it less often, have better stuff and help the environment a little. However, in the case of jeans, it looks like I need to buy the cheapest acceptable product and replace it frequently, treating it more like a consumable, Oh well, Wrangler, here I come...",2,Others have something like a belt loop failure after 6-12 months,NEGATIVE,NEGATIVE,entailment,0.3972659111022949
Best price!,5,Five Stars,POSITIVE,POSITIVE,neutral,0.9530112743377686
as described perfect fit,5,Five Stars,POSITIVE,POSITIVE,neutral,0.956902265548706
Do not know how to return these way too tight,1,One Star,NEGATIVE,NEGATIVE,neutral,0.732762336730957
"Only levi's I have bought over the last 25 years,good for work or play.  Fit is right for short fat man. Levi=high quality, will buy again.",5,comfortable,POSITIVE,POSITIVE,neutral,0.7920063138008118
Half size too big. Will try to eat more pasta.,3,Three Stars,NEGATIVE,POSITIVE,contradiction,0.7740212678909302
Very good jeans,5,Five Stars,POSITIVE,POSITIVE,neutral,0.8592767715454102
I agree with the problem with the crotch of the Levi's I have jeans that are a year old they're like new but they've already got holes in the crotch I'm going to try having a patched before I wear them at all and see if that'll help but the quality definitely is going down the drain are they no longer making these in the US?,2,... I have jeans that are a year old they're like new but they've already got holes in the crotch ...,NEGATIVE,NEGATIVE,entailment,0.5450932383537292
"These are not the traditional 501 fit...what is going on? Why has this jean changed? These fit like skinny jeans which no man should be wearing...same pant 10yrs ago was comfortable, now the leg is cut slim.  Had to move to the 569 which aren't even that relaxed, now those just fit like the 501 should",2,These fit like skinny jeans which no man should be wearing,NEGATIVE,NEGATIVE,contradiction,0.6092473268508911
Perfect!!,5,Five Stars,POSITIVE,POSITIVE,neutral,0.8145963549613953
The colour is great but the fabric is too strong eventhough we washed it before using it. Most probably will not buy it again.,3,Did not like it,NEGATIVE,NEGATIVE,contradiction,0.5506037473678589
Nice jeans over looked the button fly,3,Three Stars,POSITIVE,POSITIVE,neutral,0.9260107278823853
I bought two pairs. One was fine. The button holes of the second pair were too small. Previously I had ordered two pairs from Amazon and one of the pairs had a manufacturing defect that has reduced it's durability. Two of four pairs from Amazon with manufacturing defects. Never had this issue from bricks and mortar store.,3,Manufacturing defects,NEGATIVE,NEGATIVE,contradiction,0.5819774866104126
Fit was perfect and great quality.,5,Five Stars,POSITIVE,POSITIVE,neutral,0.9852251410484314
Price could have been less,4,Four Stars,NEGATIVE,POSITIVE,neutral,0.7530874609947205
"Just like always, I just love Levis 501s.",5,I love my 501 blues.,POSITIVE,POSITIVE,neutral,0.5283564329147339
These 501s were exactly what I ordered and fit perfectly.,5,Five Stars,POSITIVE,POSITIVE,neutral,0.9808180332183838
I've worn the 501's for years.  Love em.  And this is a pretty decent deal.,4,Love em. And this is a pretty decent deal,POSITIVE,POSITIVE,entailment,0.9675298929214478
These fit well and are very comfortable.,5,Five Stars,POSITIVE,POSITIVE,neutral,0.9653875827789307
They were as I expected. Fit was right.,5,Five Stars,POSITIVE,POSITIVE,neutral,0.9538570642471313
"My wife bought these for me, I have worn 501s for over 60 years, they fit and feel the same. I remember how proud I was when I put on my first pair AND this latest pair.",5,After all these years,POSITIVE,POSITIVE,neutral,0.9626258015632629
The length was longer than expected,1,One Star,NEGATIVE,NEGATIVE,neutral,0.9727373719215393
"Original 501 button fly the only way to go. Right fit, right color",5,Five Stars,POSITIVE,POSITIVE,neutral,0.8992481231689453
Size perfect.,4,Four Stars,POSITIVE,POSITIVE,neutral,0.9124304056167603
For the price and the comfort they are worth it. All I have in my closet is Levi's 501 jeans.,5,Very good jean,NEGATIVE,POSITIVE,neutral,0.7291015982627869
Christmas gift.,5,Five Stars,POSITIVE,POSITIVE,neutral,0.8359946012496948
"I would give them 5 stars but the fly buttons seem to be closer together then my older 501s, and are a little harder to use. Other then that the fit well.",3,Fly buttons too close together,NEGATIVE,NEGATIVE,neutral,0.5744473934173584
They fit just as I expected!!!,5,Five Stars,POSITIVE,POSITIVE,neutral,0.928234875202179
Ordered the size my husband wheres and they were  bit tighter than his old pair otherwise of coarse a good pair of jeans. They are Levis..... enough said!,4,... tighter than his old pair otherwise of coarse a good pair of jeans,POSITIVE,POSITIVE,entailment,0.8955785036087036
Great jeans,5,Five Stars,POSITIVE,POSITIVE,neutral,0.8718202114105225
I bought them for my son and had them shipped to him. He said that they fit well.,4,Four Stars,POSITIVE,POSITIVE,neutral,0.971682071685791
bad quality....after one year ...see pic,1,One Star,NEGATIVE,NEGATIVE,contradiction,0.7595394849777222
"Way too small, do not fit anything like the last pair of 501s and didn't realize they were button fly.",1,do not fit anything like the last pair of 501s and didn't realize they ...,NEGATIVE,NEGATIVE,entailment,0.8596481084823608
I like all the size and color of this pants.,5,Good product,POSITIVE,POSITIVE,neutral,0.8544755578041077
Has no zipper for fly just metal buttons,2,Two Stars,NEGATIVE,POSITIVE,neutral,0.8731077313423157
Muy bueno,5,Solo calidad,NEGATIVE,POSITIVE,contradiction,0.4069408178329468
Great materials as expected and fit just right.,5,Happy with the comfort of these Jeans,POSITIVE,POSITIVE,neutral,0.9468972086906433
I love them!,5,Five Stars,POSITIVE,POSITIVE,neutral,0.9172611236572266
Look good and fits as expected,5,Five Stars,POSITIVE,POSITIVE,neutral,0.9629493355751038
Quality and fit,5,Trust in yhe Levi brand,POSITIVE,POSITIVE,neutral,0.7942535877227783
Perfect Fit,5,Five Stars,POSITIVE,POSITIVE,neutral,0.9124017357826233
"Too small for the stated size, and I didn't realize it had a button fly which I hate. I bought it and stuck it on a shelf for a few weeks. Just tried it on and am not impressed. I'm now passed the 30 day return window and am stuck with this pair of worthless pants. :-( I guess it's going to goodwill now.",1,and I didn't realize it had a button fly which I hate. I bought it and stuck it on a ...,NEGATIVE,NEGATIVE,entailment,0.8890445232391357
"fits as expected, no surprises however, they are very stiff and not at all stretch and comfortable if you got used to wearing ""stretch jeans"" like my kids did -- they will complain about these that they are uncomfortable to wear.",3,fit as expected though not the most comfortable jeans on the market,NEGATIVE,NEGATIVE,neutral,0.9282186627388
loves them!!!,5,Five Stars,POSITIVE,POSITIVE,neutral,0.846420168876648
Belt loop broke off on first wearing.,2,OH POOP! NO LOOP!,NEGATIVE,NEGATIVE,contradiction,0.9681025743484497
"Fantastic, fast fast delivery. Mine are amazingly worn and torn in the same places as the example. They do fit a little tighter than expected but it is the week of thanksgiving and I've been nom nom noming on mass turkey and fixin's this week.

I'll just make sure to wash them in cold water from now on. I have not worn 501's in over 20 years I forgot how comfortable they are to wear... I love these 501's.",5,Love me some 501's,POSITIVE,POSITIVE,entailment,0.9270545840263367
Legs are skinny and button up fly.,2,Two Stars,POSITIVE,POSITIVE,neutral,0.9279618263244629
"Even after washing still fitting a bit large, but I am making them work",3,Three Stars,POSITIVE,POSITIVE,neutral,0.9288079738616943
Perfect,5,Five Stars,POSITIVE,POSITIVE,neutral,0.8463523983955383
Best jeans are Levi's .Buying all the time for my family,5,Five Stars,POSITIVE,POSITIVE,neutral,0.9829354286193848
love my 501's,5,Five Stars,POSITIVE,POSITIVE,neutral,0.9371235370635986
Perfect fit for picky husband. Didnt realize they were button fly.,4,Four Stars,POSITIVE,POSITIVE,neutral,0.7505442500114441
Always loved Levi jeans and their simplicity and price they are very fashionable and available in a variety of styles these particular jeans (501) fit perfect they are not tight like skinny jeans and not too baggy they have a simple yet classic look.,5,Stylish and affordable,POSITIVE,POSITIVE,entailment,0.9713035821914673
Always loved these!,5,Five Stars,POSITIVE,POSITIVE,neutral,0.9246805906295776
perfect fit as always,5,Five Stars,POSITIVE,POSITIVE,neutral,0.9425148367881775
"They are of superb quality, but they ride low like hip huggers.",4,501 Hip Huggers,NEGATIVE,POSITIVE,contradiction,0.5690605640411377
Wife loves the look and I love the fit. Ordered another pair in a different color!,5,Five Stars,POSITIVE,POSITIVE,neutral,0.9905535578727722
"Excellent quality, material and workmanship. Beautiful and comfortable pants. I highly recommend these jeans AAA+++ Sizing is perfect, loose and comfortable !!!",5,"LOVE IT ,LOVE IT Buy without hesitation AAA+++",POSITIVE,POSITIVE,neutral,0.8257373571395874
"Been a while since I'v had some Levis after rocking the country western style for many years - mostly due to that being the only style I could afford with lengths that would fit.  501s don't drape well around cowboy boots (too narrow at the bottom), so I was wearing mostly Wrangler and Ariat..

Now that I am going with a more metropolitan style, it is hard to find jeans that are long enough in any brand except Levis.  These seem to fit a little lower around the waist than I remember (but maybe they're the same) and are a little lighter, but they fit well and look nice.  I like them.  I'm 6' 2"" and weight about 185.  In dress pants I wear 34 inch waist - not sure the length as I get dress pants tailored.  Ordered a second pair of 501s after getting the first.  They look good with tennis shoes and casual dress shoes.",5,Reliably good fitting,POSITIVE,POSITIVE,neutral,0.8060327172279358
"These 501's, like all the others, fit as expected. Great price at $35.99 too. Will shop for other colors in the near future.",5,Love them and they fit great,POSITIVE,POSITIVE,entailment,0.7421135306358337
Good,5,Five Stars,POSITIVE,POSITIVE,neutral,0.8301262259483337
Levis!! Say no more. Except the price is always great with Amazon!,5,Except the price is always great with Amazon,POSITIVE,POSITIVE,entailment,0.9799687266349792
"They are cheap quality, i ordered two 501 and both a ripping everywhere.",1,One Star,NEGATIVE,NEGATIVE,contradiction,0.5768977403640747
Not very comfortable,2,So so,NEGATIVE,POSITIVE,contradiction,0.8135054111480713
Awesome jeans as usual,5,Five Stars,POSITIVE,POSITIVE,neutral,0.9158616065979004
Good quality but too large,1,Too large!,NEGATIVE,NEGATIVE,entailment,0.8726198673248291
I just lost weight and there baggy but levies arethe best britches,3,Baggy,POSITIVE,NEGATIVE,entailment,0.739700436592102
Delivery took two attempts and the 501s were much leaner than expected.,3,Three Stars,POSITIVE,POSITIVE,neutral,0.9744677543640137
"i am very surprised by how lightweight the fabric is (Dark Charcoal). color is good, just wish fabric was a normal levi jean weight... def WILL NOT buy another pair...",3,"color is good, just wish fabric was a normal levi jean ...",POSITIVE,POSITIVE,neutral,0.7269973158836365
"These are not as relaxed and pre-shrunk like Levis relaxed jeans. After getting them from the dryer, I noticed my husband having to stretch them back out (imagine a woman attempting to squeeze into a pair of jeans)
They do look great on and fit well after they are worn a bit. The price is comparable to purchasing at a department store but with Amazon, you're paying Reg price for convience.  It was nice to see these jeans came in a longer length ar 36",4,Good looking but not relaxed,POSITIVE,NEGATIVE,entailment,0.7266451716423035
Happy with purchase.,5,Five Stars,POSITIVE,POSITIVE,neutral,0.9387912750244141
Good,5,Five Stars,POSITIVE,POSITIVE,neutral,0.8301262259483337
"Compared with 513, I think 501 is not suitable for young people, so I won't choose 501 again513 better next time, but the quality of Levi's is good, and the pants are thicke",4,so I won't choose 501 again513 better next time,POSITIVE,NEGATIVE,neutral,0.9944302439689636
"I'm a huge fan of Levi's and wasn't sure on getting a pair of white jeans. But fashion is fashion and I bought a pair just to see what they'd look like in person. Other than the few tears in the pants, it fits just like the 501s true to fit, and the color isn't an obnoxious white",5,But fashion is fashion and I bought a pair just to see what they'd look like in person,POSITIVE,POSITIVE,entailment,0.6659830808639526
"Fit as expected.  Arrived in a timely manner.  No issue with the Amazon locker delivery, too.",5,Fit as expected. Arrived in a timely manner. ...,POSITIVE,POSITIVE,entailment,0.9744846224784851
the jeans that I've always used,5,Satisfied Customer,POSITIVE,POSITIVE,neutral,0.848048210144043
Good jeans,5,Good product,POSITIVE,POSITIVE,entailment,0.5985878109931946
I like these but the seams aren't double- stitched,3,Three Stars,POSITIVE,POSITIVE,neutral,0.911291241645813
all fit and style you have come to expect from Levis so better than driving to any store if you are sure of your size was delivered one day late... so prepare ahead for that possibility.,5,better than the mall,POSITIVE,POSITIVE,neutral,0.46674805879592896
"Darn it. Levi's used to be so sturdy, even the prewashed ones.

Not any more :(

Color fades very fast even when laundered on gentle in cold water w/ color safe detergent (and since when did I need to pamper 501's??). Belt loops pull out very easy as well.

Another American icon going to kaka.",2,They just keep cheaper and cheaper :(,NEGATIVE,POSITIVE,neutral,0.9896519780158997
"Fit  and style as described, good product for the price offered by Amazon.",5,Better than Wrangler!,POSITIVE,POSITIVE,neutral,0.9845442175865173
Great job... perfect fit and as I expected. Thanks for the value purchase.,4,Great deal.,POSITIVE,POSITIVE,entailment,0.7314223051071167
"Arrived when expected, looks great, fits great, and feels great! Now when I need more Levi's, I know where to go. Amazon! Thanks again! No more waiting in line at a stinky store for me.",5,Amazon is awesome!,POSITIVE,POSITIVE,entailment,0.646115243434906
"Great price, saved lots of money and will definitely be buying more ... Thanks",5,Perfect fit & price !,POSITIVE,POSITIVE,neutral,0.7041561603546143
Perfect fit ! So happy with this purchase,5,Perfect fit! So happy with this,POSITIVE,POSITIVE,entailment,0.9800249934196472
Beautiful,5,Five Stars,POSITIVE,POSITIVE,neutral,0.8992364406585693
"Great!  Ordered on a Thursday, arrived on Friday, it doesn't get any better than that.",5,Great! Ordered on a Thursday,NEGATIVE,POSITIVE,entailment,0.8872572183609009
Good jeans. Not what I wanted. I forgot to add the word denim,5,Good jeans. Not what I wanted,NEGATIVE,NEGATIVE,entailment,0.8001318573951721
LOVE the button fly!!,5,Five Stars,POSITIVE,POSITIVE,neutral,0.8878552913665771
Jeans are great,5,Five Stars,POSITIVE,POSITIVE,neutral,0.9160706996917725
Classic style that I always go to,5,A classic,POSITIVE,POSITIVE,neutral,0.5470324754714966
I normally wear 40~ 32. They were too tight and had to make another purchase for 42~32. Why can't my second order of 4232 be free instead of going through the hassle?,1,40~32 too tight,NEGATIVE,NEGATIVE,entailment,0.5985861420631409
"My bad, I thought I was thinner",3,too small,NEGATIVE,NEGATIVE,neutral,0.7905814051628113
Great jeans. Everything you'd expect from Levi's.,5,Five Stars,POSITIVE,POSITIVE,neutral,0.9263222217559814
Excellent pair of Levi jeans that really make my man's butt look great!,5,Five Stars,POSITIVE,POSITIVE,neutral,0.9402707815170288
Great Fit. If you know what you wear in Levis than that's all you need to know. Love the Dimensional Blue!,5,Great Fit. If you know what you wear in ...,POSITIVE,POSITIVE,entailment,0.737741231918335
I pleased with my order,4,Four Stars,POSITIVE,POSITIVE,neutral,0.9354512691497803
my hubby is already a very fine and fit man but these jeans just made him look even better!,5,Five Stars,POSITIVE,POSITIVE,neutral,0.9825116991996765
great jeans,4,Four Stars,POSITIVE,POSITIVE,neutral,0.8682764172554016
Best price ever for same Levi guality,5,Save $$,POSITIVE,NEGATIVE,neutral,0.7546122670173645
Levis 501s in my size. What more can I say? Its the denim standard.,5,Great Jeans. Great Price.,NEGATIVE,POSITIVE,neutral,0.9333474040031433
Favorite jeans,5,Five Stars,POSITIVE,POSITIVE,neutral,0.9001085758209229
As expected,5,Five Stars,NEGATIVE,POSITIVE,neutral,0.8944005966186523
As close to the old ones as anything in a long time.,5,Five Stars,NEGATIVE,POSITIVE,neutral,0.9181303381919861
All my Levi's that I ordered from Amazon fit perfectly and I will be ordering more in the future!,5,All my Levi's that I ordered from Amazon fit perfectly ...,POSITIVE,POSITIVE,entailment,0.9124351143836975
"Being 6'6"" I rarely find my size in stores. I wear a 34/35 X 36. These fit great in the waist and the length, but they were too tight in the thighs. More like a skinny jean fit. I am tall and slim but I do cycle and hike so I have muscular thighs.",3,Great if you have skinny legs but not for everyone.,NEGATIVE,POSITIVE,neutral,0.9252995252609253
You can't go wrong with Levi's 501,5,The legend...,POSITIVE,POSITIVE,neutral,0.8183660507202148
Item arrived on time and as listed. A++,5,Five Stars,POSITIVE,POSITIVE,neutral,0.8066598773002625
"The Levis Red tab on back pocket does not spell out Levis symbol on tab like original jeans & as advertised. The red tab just has an R. Though Levis site says blank R tabs are authentic and they trademark red tab alone without Levis symbol, its still very disappointing. Otherwise jeans check out: Heavy fabric, copper rivets on pockets, uniform orange stitching, Levis stamp on inner pocket. And FYI, made in Egypt, not the most valuable Made in USA like originals. Still more valuable being made in China or Mexico.",1,No Levis Symbol on Red tab on back pocket. SCREAM!,NEGATIVE,NEGATIVE,neutral,0.5484426021575928
I don't have a printer that works. I have no idea how I will return these foolishly depended on what was written.,1,Don't do this,NEGATIVE,NEGATIVE,neutral,0.7996004223823547
Perfect fit!,5,Great!,POSITIVE,POSITIVE,entailment,0.5852730870246887
Muy bien.,5,Five Stars,POSITIVE,POSITIVE,neutral,0.8184499144554138
"I bought two pairs of pants in these exact size 6 months ago and they fit great, but ripped very quickly.  Order the EXACT size and they are way too small. Of course I washed them, so now not only are these pants low quality and inconsistent sizes,  but I also cannot return them. Thanks Levis!",2,Quality and Sizes are Terrible,NEGATIVE,NEGATIVE,contradiction,0.4325546324253082
I cannot fathom who would prefer button flys over zipper so I did not even think to check the description for it.,1,Button flys are an abombination,NEGATIVE,NEGATIVE,neutral,0.8809118270874023
Great jeans. Great fit. Great price.,5,501,POSITIVE,POSITIVE,neutral,0.9565427303314209
I have worn Levi's 501's since about 1948.  Over the last 10 years I have had to drive to a store 80 miles away.  They would order them for me and they came in the mail.  I have dreaded that 80 mile trip.  I got the inspiration to check on Amazon.com and there they were!  The rest is history!,5,I'm back in the game!,NEGATIVE,POSITIVE,neutral,0.9740087985992432
"Great pants, fit really well",5,Five Stars,POSITIVE,POSITIVE,neutral,0.9422992467880249
Great choice,5,Five Stars,POSITIVE,POSITIVE,neutral,0.890105128288269
"hello, yes, unfortunately I ordered jeans very small.",4,Four Stars,NEGATIVE,POSITIVE,contradiction,0.49253049492836
love my 501's,5,Five Stars,POSITIVE,POSITIVE,neutral,0.9371235370635986
Cotton denim is not as thick. Traditional double roll hem is replaced by single. Double stitching missing. Wear faster. Holes within 4 months vs a year.,3,Not traditional 501's,NEGATIVE,NEGATIVE,contradiction,0.6232662200927734
"No surprises, just good old 501 jeans...",5,just good old 501 jeans,NEGATIVE,POSITIVE,neutral,0.7393873929977417
Excellent,5,Five Stars,POSITIVE,POSITIVE,neutral,0.8514291048049927
"My husband is really ""picky"" about his 501 jeans.  He was pleased with everything about them!  When he's happy, I'm happy!  Thanks, Scooter Ploeger",5,He was pleased with everything about them,POSITIVE,POSITIVE,entailment,0.5829694271087646
Exactly what i wanted. Thank you.,4,Four Stars,POSITIVE,POSITIVE,neutral,0.8768002986907959
I only wear levis. They always fit perfectly.  I got a black pair a while back and got the shrink to fit and become almost to tight after washing them but still fit. Love levis.  There the best fitting jeans I have ever worn.,5,Love levis. There the best fitting jeans I have ...,POSITIVE,POSITIVE,entailment,0.8051079511642456
Great!,5,Five Stars,POSITIVE,POSITIVE,neutral,0.8449100852012634
perfect,5,Five Stars,POSITIVE,POSITIVE,neutral,0.8144450187683105
"Exactly what i expected, im very pleased",5,Five Stars,POSITIVE,POSITIVE,neutral,0.7936158776283264
Great pants cheap price fast delivery no complaints. Will buy more as soon as possible.,5,Levis 501 pants,NEGATIVE,POSITIVE,neutral,0.9902986288070679
Very nice jeans,5,Five Stars,POSITIVE,POSITIVE,neutral,0.8368251323699951
Good fit and nice looking pair of jeans,5,Five Stars,POSITIVE,POSITIVE,neutral,0.9505196809768677
These are great well made pants.  The fit for me is that the waist was a little tight compared to other pants and the length was a little too long so order accordingly.  The return process is painless though if you don't.,5,Very Nice,POSITIVE,POSITIVE,neutral,0.7957867980003357
They were great jeans but had to return...they were button and he wanted zipper.,5,Five Stars,NEGATIVE,POSITIVE,neutral,0.8088527917861938
